"No.","Time","Source","Destination","Protocol","Length","Info","Intervalo"
"11","1.144176","5.196.78.28","192.168.3.103","MQTT","88","Publish Message [esp32/felipe/dht]","0.000000000"
"13","1.192648","192.168.3.103","5.196.78.28","TCP","54","51332  >  1883 [ACK] Seq=1 Ack=35 Win=251 Len=0","0.048472000"
"57","5.851103","5.196.78.28","192.168.3.103","MQTT","88","Publish Message [esp32/felipe/dht]","4.658455000"
"59","5.897863","192.168.3.103","5.196.78.28","TCP","54","51332  >  1883 [ACK] Seq=1 Ack=69 Win=251 Len=0","0.046760000"
"117","11.111766","5.196.78.28","192.168.3.103","MQTT","88","Publish Message [esp32/felipe/dht]","5.213903000"
"118","11.157032","192.168.3.103","5.196.78.28","TCP","54","51332  >  1883 [ACK] Seq=1 Ack=103 Win=250 Len=0","0.045266000"
"182","16.576087","5.196.78.28","192.168.3.103","MQTT","88","Publish Message [esp32/felipe/dht]","5.419055000"
"184","16.624415","192.168.3.103","5.196.78.28","TCP","54","51332  >  1883 [ACK] Seq=1 Ack=137 Win=250 Len=0","0.048328000"
"236","22.637702","5.196.78.28","192.168.3.103","MQTT","88","Publish Message [esp32/felipe/dht]","6.013287000"
"237","22.692036","192.168.3.103","5.196.78.28","TCP","54","51332  >  1883 [ACK] Seq=1 Ack=171 Win=250 Len=0","0.054334000"
"325","28.160305","5.196.78.28","192.168.3.103","MQTT","88","Publish Message [esp32/felipe/dht]","5.468269000"
"326","28.213892","192.168.3.103","5.196.78.28","TCP","54","51332  >  1883 [ACK] Seq=1 Ack=205 Win=250 Len=0","0.053587000"
"480","33.103912","5.196.78.28","192.168.3.103","MQTT","88","Publish Message [esp32/felipe/dht]","4.890020000"
"482","33.144659","192.168.3.103","5.196.78.28","TCP","54","51332  >  1883 [ACK] Seq=1 Ack=239 Win=255 Len=0","0.040747000"
"532","38.508231","5.196.78.28","192.168.3.103","MQTT","88","Publish Message [esp32/felipe/dht]","5.363572000"
"533","38.552698","192.168.3.103","5.196.78.28","TCP","54","51332  >  1883 [ACK] Seq=1 Ack=273 Win=255 Len=0","0.044467000"
"593","43.288630","5.196.78.28","192.168.3.103","MQTT","88","Publish Message [esp32/felipe/dht]","4.735932000"
"594","43.339299","192.168.3.103","5.196.78.28","TCP","54","51332  >  1883 [ACK] Seq=1 Ack=307 Win=255 Len=0","0.050669000"
"790","48.514336","5.196.78.28","192.168.3.103","MQTT","88","Publish Message [esp32/felipe/dht]","5.175037000"
"791","48.569070","192.168.3.103","5.196.78.28","TCP","54","51332  >  1883 [ACK] Seq=1 Ack=341 Win=255 Len=0","0.054734000"
"810","51.540319","192.168.3.103","5.196.78.28","MQTT","56","Ping Request","2.971249000"
"812","51.756067","5.196.78.28","192.168.3.103","TCP","60","1883  >  51332 [ACK] Seq=341 Ack=3 Win=502 Len=0","0.215748000"
"819","53.391200","5.196.78.28","192.168.3.103","MQTT","60","Ping Response","1.635133000"
"821","53.434284","192.168.3.103","5.196.78.28","TCP","54","51332  >  1883 [ACK] Seq=3 Ack=343 Win=255 Len=0","0.043084000"
"855","54.255219","5.196.78.28","192.168.3.103","MQTT","88","Publish Message [esp32/felipe/dht]","0.820935000"
"857","54.300760","192.168.3.103","5.196.78.28","TCP","54","51332  >  1883 [ACK] Seq=3 Ack=377 Win=255 Len=0","0.045541000"
"1779","59.080003","5.196.78.28","192.168.3.103","MQTT","88","Publish Message [esp32/felipe/dht]","4.779243000"
"1786","59.123481","192.168.3.103","5.196.78.28","TCP","54","51332  >  1883 [ACK] Seq=3 Ack=411 Win=255 Len=0","0.043478000"
"2676","64.437160","5.196.78.28","192.168.3.103","MQTT","88","Publish Message [esp32/felipe/dht]","5.313679000"
"2679","64.477176","192.168.3.103","5.196.78.28","TCP","54","51332  >  1883 [ACK] Seq=3 Ack=445 Win=255 Len=0","0.040016000"
"3698","70.451507","5.196.78.28","192.168.3.103","MQTT","88","Publish Message [esp32/felipe/dht]","5.974331000"
"3705","70.504351","192.168.3.103","5.196.78.28","TCP","54","51332  >  1883 [ACK] Seq=3 Ack=479 Win=255 Len=0","0.052844000"
"4585","75.768955","5.196.78.28","192.168.3.103","MQTT","88","Publish Message [esp32/felipe/dht]","5.264604000"
"4586","75.818823","192.168.3.103","5.196.78.28","TCP","54","51332  >  1883 [ACK] Seq=3 Ack=513 Win=254 Len=0","0.049868000"
"5289","80.575053","5.196.78.28","192.168.3.103","MQTT","88","Publish Message [esp32/felipe/dht]","4.756230000"
"5334","80.618303","192.168.3.103","5.196.78.28","TCP","54","51332  >  1883 [ACK] Seq=3 Ack=547 Win=254 Len=0","0.043250000"
"6533","86.371062","5.196.78.28","192.168.3.103","MQTT","88","Publish Message [esp32/felipe/dht]","5.752759000"
"6535","86.413107","192.168.3.103","5.196.78.28","TCP","54","51332  >  1883 [ACK] Seq=3 Ack=581 Win=254 Len=0","0.042045000"
"14413","91.084426","5.196.78.28","192.168.3.103","MQTT","88","Publish Message [esp32/felipe/dht]","4.671319000"
"14415","91.132087","192.168.3.103","5.196.78.28","TCP","54","51332  >  1883 [ACK] Seq=3 Ack=615 Win=254 Len=0","0.047661000"
"24658","96.182905","5.196.78.28","192.168.3.103","MQTT","88","Publish Message [esp32/felipe/dht]","5.050818000"
"24659","96.229484","192.168.3.103","5.196.78.28","TCP","54","51332  >  1883 [ACK] Seq=3 Ack=649 Win=254 Len=0","0.046579000"
"24805","100.943957","5.196.78.28","192.168.3.103","MQTT","88","Publish Message [esp32/felipe/dht]","4.714473000"
"24806","100.998419","192.168.3.103","5.196.78.28","TCP","54","51332  >  1883 [ACK] Seq=3 Ack=683 Win=254 Len=0","0.054462000"
"25143","106.288813","5.196.78.28","192.168.3.103","MQTT","88","Publish Message [esp32/felipe/dht]","5.290394000"
"25144","106.334517","192.168.3.103","5.196.78.28","TCP","54","51332  >  1883 [ACK] Seq=3 Ack=717 Win=254 Len=0","0.045704000"
"25508","111.559670","5.196.78.28","192.168.3.103","MQTT","88","Publish Message [esp32/felipe/dht]","5.225153000"
"25509","111.559958","192.168.3.103","5.196.78.28","MQTT","56","Ping Request","0.000288000"
"25523","111.775234","5.196.78.28","192.168.3.103","TCP","60","1883  >  51332 [ACK] Seq=751 Ack=5 Win=502 Len=0","0.215276000"
"25541","113.102283","5.196.78.28","192.168.3.103","MQTT","60","Ping Response","1.327049000"
"25542","113.151112","192.168.3.103","5.196.78.28","TCP","54","51332  >  1883 [ACK] Seq=5 Ack=753 Win=253 Len=0","0.048829000"
"25572","117.150505","5.196.78.28","192.168.3.103","MQTT","88","Publish Message [esp32/felipe/dht]","3.999393000"
"25573","117.197217","192.168.3.103","5.196.78.28","TCP","54","51332  >  1883 [ACK] Seq=5 Ack=787 Win=253 Len=0","0.046712000"
"25615","122.353872","5.196.78.28","192.168.3.103","MQTT","88","Publish Message [esp32/felipe/dht]","5.156655000"
"25616","122.402336","192.168.3.103","5.196.78.28","TCP","54","51332  >  1883 [ACK] Seq=5 Ack=821 Win=253 Len=0","0.048464000"
"25692","127.982535","5.196.78.28","192.168.3.103","MQTT","88","Publish Message [esp32/felipe/dht]","5.580199000"
"25695","128.023269","192.168.3.103","5.196.78.28","TCP","54","51332  >  1883 [ACK] Seq=5 Ack=855 Win=253 Len=0","0.040734000"
"25780","133.772936","5.196.78.28","192.168.3.103","MQTT","88","Publish Message [esp32/felipe/dht]","5.749667000"
"25782","133.825003","192.168.3.103","5.196.78.28","TCP","54","51332  >  1883 [ACK] Seq=5 Ack=889 Win=253 Len=0","0.052067000"
"25821","139.146141","5.196.78.28","192.168.3.103","MQTT","88","Publish Message [esp32/felipe/dht]","5.321138000"
"25823","139.200635","192.168.3.103","5.196.78.28","TCP","54","51332  >  1883 [ACK] Seq=5 Ack=923 Win=253 Len=0","0.054494000"
"25916","144.365687","5.196.78.28","192.168.3.103","MQTT","88","Publish Message [esp32/felipe/dht]","5.165052000"
"25917","144.419935","192.168.3.103","5.196.78.28","TCP","54","51332  >  1883 [ACK] Seq=5 Ack=957 Win=253 Len=0","0.054248000"
"25988","149.410954","5.196.78.28","192.168.3.103","MQTT","88","Publish Message [esp32/felipe/dht]","4.991019000"
"25989","149.452964","192.168.3.103","5.196.78.28","TCP","54","51332  >  1883 [ACK] Seq=5 Ack=991 Win=253 Len=0","0.042010000"
"26064","153.972117","5.196.78.28","192.168.3.103","MQTT","88","Publish Message [esp32/felipe/dht]","4.519153000"
"26065","154.021950","192.168.3.103","5.196.78.28","TCP","54","51332  >  1883 [ACK] Seq=5 Ack=1025 Win=252 Len=0","0.049833000"
"26111","159.635833","5.196.78.28","192.168.3.103","MQTT","88","Publish Message [esp32/felipe/dht]","5.613883000"
"26113","159.677406","192.168.3.103","5.196.78.28","TCP","54","51332  >  1883 [ACK] Seq=5 Ack=1059 Win=252 Len=0","0.041573000"
"26148","164.990537","5.196.78.28","192.168.3.103","MQTT","88","Publish Message [esp32/felipe/dht]","5.313131000"
"26151","165.041048","192.168.3.103","5.196.78.28","TCP","54","51332  >  1883 [ACK] Seq=5 Ack=1093 Win=252 Len=0","0.050511000"
"26220","170.905180","5.196.78.28","192.168.3.103","MQTT","88","Publish Message [esp32/felipe/dht]","5.864132000"
"26223","170.951310","192.168.3.103","5.196.78.28","TCP","54","51332  >  1883 [ACK] Seq=5 Ack=1127 Win=252 Len=0","0.046130000"
"26231","171.912872","192.168.3.103","5.196.78.28","MQTT","56","Ping Request","0.961562000"
"26232","172.130475","5.196.78.28","192.168.3.103","TCP","60","1883  >  51332 [ACK] Seq=1127 Ack=7 Win=502 Len=0","0.217603000"
"26241","173.909361","5.196.78.28","192.168.3.103","MQTT","60","Ping Response","1.778886000"
"26244","173.948704","192.168.3.103","5.196.78.28","TCP","54","51332  >  1883 [ACK] Seq=7 Ack=1129 Win=252 Len=0","0.039343000"
"26257","175.520283","5.196.78.28","192.168.3.103","MQTT","88","Publish Message [esp32/felipe/dht]","1.571579000"
"26260","175.562213","192.168.3.103","5.196.78.28","TCP","54","51332  >  1883 [ACK] Seq=7 Ack=1163 Win=252 Len=0","0.041930000"
"26310","181.538051","5.196.78.28","192.168.3.103","MQTT","88","Publish Message [esp32/felipe/dht]","5.975838000"
"26312","181.582038","192.168.3.103","5.196.78.28","TCP","54","51332  >  1883 [ACK] Seq=7 Ack=1197 Win=252 Len=0","0.043987000"
"26350","186.196835","5.196.78.28","192.168.3.103","MQTT","88","Publish Message [esp32/felipe/dht]","4.614797000"
"26351","186.239483","192.168.3.103","5.196.78.28","TCP","54","51332  >  1883 [ACK] Seq=7 Ack=1231 Win=252 Len=0","0.042648000"
"26395","192.332112","5.196.78.28","192.168.3.103","MQTT","88","Publish Message [esp32/felipe/dht]","6.092629000"
"26396","192.373999","192.168.3.103","5.196.78.28","TCP","54","51332  >  1883 [ACK] Seq=7 Ack=1265 Win=251 Len=0","0.041887000"
"26434","197.516235","5.196.78.28","192.168.3.103","MQTT","88","Publish Message [esp32/felipe/dht]","5.142236000"
"26435","197.558581","192.168.3.103","5.196.78.28","TCP","54","51332  >  1883 [ACK] Seq=7 Ack=1299 Win=251 Len=0","0.042346000"
"32305","203.054442","5.196.78.28","192.168.3.103","MQTT","88","Publish Message [esp32/felipe/dht]","5.495861000"
"32307","203.094275","192.168.3.103","5.196.78.28","TCP","54","51332  >  1883 [ACK] Seq=7 Ack=1333 Win=251 Len=0","0.039833000"
"33937","208.246403","5.196.78.28","192.168.3.103","MQTT","88","Publish Message [esp32/felipe/dht]","5.152128000"
"34007","208.285606","192.168.3.103","5.196.78.28","TCP","54","51332  >  1883 [ACK] Seq=7 Ack=1367 Win=251 Len=0","0.039203000"
"51709","212.799704","5.196.78.28","192.168.3.103","MQTT","88","Publish Message [esp32/felipe/dht]","4.514098000"
"52027","212.840727","192.168.3.103","5.196.78.28","TCP","54","51332  >  1883 [ACK] Seq=7 Ack=1401 Win=251 Len=0","0.041023000"
"73853","218.384854","5.196.78.28","192.168.3.103","MQTT","88","Publish Message [esp32/felipe/dht]","5.544127000"
"73963","218.424967","192.168.3.103","5.196.78.28","TCP","54","51332  >  1883 [ACK] Seq=7 Ack=1435 Win=251 Len=0","0.040113000"
"77528","223.288733","5.196.78.28","192.168.3.103","MQTT","88","Publish Message [esp32/felipe/dht]","4.863766000"
"77532","223.329410","192.168.3.103","5.196.78.28","TCP","54","51332  >  1883 [ACK] Seq=7 Ack=1469 Win=251 Len=0","0.040677000"
"83526","228.214655","5.196.78.28","192.168.3.103","MQTT","88","Publish Message [esp32/felipe/dht]","4.885245000"
"83830","228.255333","192.168.3.103","5.196.78.28","TCP","54","51332  >  1883 [ACK] Seq=7 Ack=1503 Win=251 Len=0","0.040678000"
"89425","232.215427","192.168.3.103","5.196.78.28","MQTT","56","Ping Request","3.960094000"
"89451","232.429657","5.196.78.28","192.168.3.103","TCP","60","1883  >  51332 [ACK] Seq=1503 Ack=9 Win=502 Len=0","0.214230000"
"91547","233.280170","5.196.78.28","192.168.3.103","MQTT","88","Publish Message [esp32/felipe/dht]","0.850513000"
"91548","233.320766","192.168.3.103","5.196.78.28","TCP","54","51332  >  1883 [ACK] Seq=9 Ack=1537 Win=250 Len=0","0.040596000"
"91782","234.116637","5.196.78.28","192.168.3.103","MQTT","60","Ping Response","0.795871000"
"91785","234.157000","192.168.3.103","5.196.78.28","TCP","54","51332  >  1883 [ACK] Seq=9 Ack=1539 Win=250 Len=0","0.040363000"
"91903","239.273573","5.196.78.28","192.168.3.103","MQTT","88","Publish Message [esp32/felipe/dht]","5.116573000"
"91904","239.314340","192.168.3.103","5.196.78.28","TCP","54","51332  >  1883 [ACK] Seq=9 Ack=1573 Win=250 Len=0","0.040767000"
"92358","244.281968","5.196.78.28","192.168.3.103","MQTT","88","Publish Message [esp32/felipe/dht]","4.967628000"
"92360","244.322914","192.168.3.103","5.196.78.28","TCP","54","51332  >  1883 [ACK] Seq=9 Ack=1607 Win=250 Len=0","0.040946000"
"92633","250.227707","5.196.78.28","192.168.3.103","MQTT","88","Publish Message [esp32/felipe/dht]","5.904793000"
"92638","250.268002","192.168.3.103","5.196.78.28","TCP","54","51332  >  1883 [ACK] Seq=9 Ack=1641 Win=250 Len=0","0.040295000"
"94651","254.511045","5.196.78.28","192.168.3.103","MQTT","88","Publish Message [esp32/felipe/dht]","4.243043000"
"94652","254.552151","192.168.3.103","5.196.78.28","TCP","54","51332  >  1883 [ACK] Seq=9 Ack=1675 Win=255 Len=0","0.041106000"
"95780","259.636673","5.196.78.28","192.168.3.103","MQTT","88","Publish Message [esp32/felipe/dht]","5.084522000"
"95785","259.682621","192.168.3.103","5.196.78.28","TCP","54","51332  >  1883 [ACK] Seq=9 Ack=1709 Win=255 Len=0","0.045948000"
"96148","264.367615","5.196.78.28","192.168.3.103","MQTT","88","Publish Message [esp32/felipe/dht]","4.684994000"
"96149","264.411745","192.168.3.103","5.196.78.28","TCP","54","51332  >  1883 [ACK] Seq=9 Ack=1743 Win=255 Len=0","0.044130000"
"96271","269.856789","5.196.78.28","192.168.3.103","MQTT","88","Publish Message [esp32/felipe/dht]","5.445044000"
"96272","269.907860","192.168.3.103","5.196.78.28","TCP","54","51332  >  1883 [ACK] Seq=9 Ack=1777 Win=255 Len=0","0.051071000"
"96310","275.288388","5.196.78.28","192.168.3.103","MQTT","88","Publish Message [esp32/felipe/dht]","5.380528000"
"96314","275.342548","192.168.3.103","5.196.78.28","TCP","54","51332  >  1883 [ACK] Seq=9 Ack=1811 Win=255 Len=0","0.054160000"
"96354","280.849477","5.196.78.28","192.168.3.103","MQTT","88","Publish Message [esp32/felipe/dht]","5.506929000"
"96355","280.894453","192.168.3.103","5.196.78.28","TCP","54","51332  >  1883 [ACK] Seq=9 Ack=1845 Win=255 Len=0","0.044976000"
"96399","286.774115","5.196.78.28","192.168.3.103","MQTT","88","Publish Message [esp32/felipe/dht]","5.879662000"
"96400","286.820378","192.168.3.103","5.196.78.28","TCP","54","51332  >  1883 [ACK] Seq=9 Ack=1879 Win=255 Len=0","0.046263000"
"96438","291.439105","5.196.78.28","192.168.3.103","MQTT","88","Publish Message [esp32/felipe/dht]","4.618727000"
"96440","291.493545","192.168.3.103","5.196.78.28","TCP","54","51332  >  1883 [ACK] Seq=9 Ack=1913 Win=255 Len=0","0.054440000"
"96445","292.439522","192.168.3.103","5.196.78.28","MQTT","56","Ping Request","0.945977000"
"96448","292.656861","5.196.78.28","192.168.3.103","TCP","60","1883  >  51332 [ACK] Seq=1913 Ack=11 Win=502 Len=0","0.217339000"
"96459","293.875227","5.196.78.28","192.168.3.103","MQTT","60","Ping Response","1.218366000"
"96460","293.920253","192.168.3.103","5.196.78.28","TCP","54","51332  >  1883 [ACK] Seq=11 Ack=1915 Win=255 Len=0","0.045026000"
"96479","297.608834","5.196.78.28","192.168.3.103","MQTT","88","Publish Message [esp32/felipe/dht]","3.688581000"
"96480","297.663392","192.168.3.103","5.196.78.28","TCP","54","51332  >  1883 [ACK] Seq=11 Ack=1949 Win=254 Len=0","0.054558000"
"96530","302.029206","5.196.78.28","192.168.3.103","MQTT","88","Publish Message [esp32/felipe/dht]","4.365814000"
"96531","302.080640","192.168.3.103","5.196.78.28","TCP","54","51332  >  1883 [ACK] Seq=11 Ack=1983 Win=254 Len=0","0.051434000"
"96571","307.089712","5.196.78.28","192.168.3.103","MQTT","88","Publish Message [esp32/felipe/dht]","5.009072000"
"96573","307.138226","192.168.3.103","5.196.78.28","TCP","54","51332  >  1883 [ACK] Seq=11 Ack=2017 Win=254 Len=0","0.048514000"
"96607","312.057004","5.196.78.28","192.168.3.103","MQTT","88","Publish Message [esp32/felipe/dht]","4.918778000"
"96608","312.099947","192.168.3.103","5.196.78.28","TCP","54","51332  >  1883 [ACK] Seq=11 Ack=2051 Win=254 Len=0","0.042943000"
"96642","317.317539","5.196.78.28","192.168.3.103","MQTT","88","Publish Message [esp32/felipe/dht]","5.217592000"
"96643","317.371377","192.168.3.103","5.196.78.28","TCP","54","51332  >  1883 [ACK] Seq=11 Ack=2085 Win=254 Len=0","0.053838000"
"96691","322.661530","5.196.78.28","192.168.3.103","MQTT","88","Publish Message [esp32/felipe/dht]","5.290153000"
"96692","322.703112","192.168.3.103","5.196.78.28","TCP","54","51332  >  1883 [ACK] Seq=11 Ack=2119 Win=254 Len=0","0.041582000"
"96732","327.997240","5.196.78.28","192.168.3.103","MQTT","88","Publish Message [esp32/felipe/dht]","5.294128000"
"96733","328.045710","192.168.3.103","5.196.78.28","TCP","54","51332  >  1883 [ACK] Seq=11 Ack=2153 Win=254 Len=0","0.048470000"
"96764","333.156520","5.196.78.28","192.168.3.103","MQTT","88","Publish Message [esp32/felipe/dht]","5.110810000"
"96765","333.200349","192.168.3.103","5.196.78.28","TCP","54","51332  >  1883 [ACK] Seq=11 Ack=2187 Win=253 Len=0","0.043829000"
"96802","338.331560","5.196.78.28","192.168.3.103","MQTT","88","Publish Message [esp32/felipe/dht]","5.131211000"
"96803","338.382590","192.168.3.103","5.196.78.28","TCP","54","51332  >  1883 [ACK] Seq=11 Ack=2221 Win=253 Len=0","0.051030000"
"96837","344.259731","5.196.78.28","192.168.3.103","MQTT","88","Publish Message [esp32/felipe/dht]","5.877141000"
"96838","344.308414","192.168.3.103","5.196.78.28","TCP","54","51332  >  1883 [ACK] Seq=11 Ack=2255 Win=253 Len=0","0.048683000"
"96894","348.965831","5.196.78.28","192.168.3.103","MQTT","88","Publish Message [esp32/felipe/dht]","4.657417000"
"96896","349.014547","192.168.3.103","5.196.78.28","TCP","54","51332  >  1883 [ACK] Seq=11 Ack=2289 Win=253 Len=0","0.048716000"
"96931","353.003755","192.168.3.103","5.196.78.28","MQTT","56","Ping Request","3.989208000"
"96937","353.220132","5.196.78.28","192.168.3.103","TCP","60","1883  >  51332 [ACK] Seq=2289 Ack=13 Win=502 Len=0","0.216377000"
"96947","354.507213","5.196.78.28","192.168.3.103","MQTT","60","Ping Response","1.287081000"
"96951","354.559077","192.168.3.103","5.196.78.28","TCP","54","51332  >  1883 [ACK] Seq=13 Ack=2291 Win=253 Len=0","0.051864000"
"96952","354.577971","5.196.78.28","192.168.3.103","MQTT","88","Publish Message [esp32/felipe/dht]","0.018894000"
"96953","354.621016","192.168.3.103","5.196.78.28","TCP","54","51332  >  1883 [ACK] Seq=13 Ack=2325 Win=253 Len=0","0.043045000"
"96990","359.768152","5.196.78.28","192.168.3.103","MQTT","88","Publish Message [esp32/felipe/dht]","5.147136000"
"96991","359.813365","192.168.3.103","5.196.78.28","TCP","54","51332  >  1883 [ACK] Seq=13 Ack=2359 Win=253 Len=0","0.045213000"
"97032","364.857948","5.196.78.28","192.168.3.103","MQTT","88","Publish Message [esp32/felipe/dht]","5.044583000"
"97033","364.908102","192.168.3.103","5.196.78.28","TCP","54","51332  >  1883 [ACK] Seq=13 Ack=2393 Win=253 Len=0","0.050154000"
"97075","370.891635","5.196.78.28","192.168.3.103","MQTT","88","Publish Message [esp32/felipe/dht]","5.983533000"
"97079","370.938070","192.168.3.103","5.196.78.28","TCP","54","51332  >  1883 [ACK] Seq=13 Ack=2427 Win=253 Len=0","0.046435000"
"97111","375.717735","5.196.78.28","192.168.3.103","MQTT","88","Publish Message [esp32/felipe/dht]","4.779665000"
"97112","375.765828","192.168.3.103","5.196.78.28","TCP","54","51332  >  1883 [ACK] Seq=13 Ack=2461 Win=252 Len=0","0.048093000"
"97239","381.737309","5.196.78.28","192.168.3.103","MQTT","88","Publish Message [esp32/felipe/dht]","5.971481000"
"97240","381.785045","192.168.3.103","5.196.78.28","TCP","54","51332  >  1883 [ACK] Seq=13 Ack=2495 Win=252 Len=0","0.047736000"
"97277","386.331241","5.196.78.28","192.168.3.103","MQTT","88","Publish Message [esp32/felipe/dht]","4.546196000"
"97278","386.381951","192.168.3.103","5.196.78.28","TCP","54","51332  >  1883 [ACK] Seq=13 Ack=2529 Win=252 Len=0","0.050710000"
"97343","391.954757","5.196.78.28","192.168.3.103","MQTT","88","Publish Message [esp32/felipe/dht]","5.572806000"
"97344","391.999710","192.168.3.103","5.196.78.28","TCP","54","51332  >  1883 [ACK] Seq=13 Ack=2563 Win=252 Len=0","0.044953000"
"97374","396.845960","5.196.78.28","192.168.3.103","MQTT","88","Publish Message [esp32/felipe/dht]","4.846250000"
"97375","396.900036","192.168.3.103","5.196.78.28","TCP","54","51332  >  1883 [ACK] Seq=13 Ack=2597 Win=252 Len=0","0.054076000"
"97402","401.904627","5.196.78.28","192.168.3.103","MQTT","88","Publish Message [esp32/felipe/dht]","5.004591000"
"97403","401.947106","192.168.3.103","5.196.78.28","TCP","54","51332  >  1883 [ACK] Seq=13 Ack=2631 Win=252 Len=0","0.042479000"
"97447","407.435856","5.196.78.28","192.168.3.103","MQTT","88","Publish Message [esp32/felipe/dht]","5.488750000"
"97448","407.480377","192.168.3.103","5.196.78.28","TCP","54","51332  >  1883 [ACK] Seq=13 Ack=2665 Win=252 Len=0","0.044521000"
"97479","413.071559","5.196.78.28","192.168.3.103","MQTT","88","Publish Message [esp32/felipe/dht]","5.591182000"
"97480","413.071892","192.168.3.103","5.196.78.28","MQTT","56","Ping Request","0.000333000"
"97483","413.287464","5.196.78.28","192.168.3.103","TCP","60","1883  >  51332 [ACK] Seq=2699 Ack=15 Win=502 Len=0","0.215572000"
"97493","414.454337","5.196.78.28","192.168.3.103","MQTT","60","Ping Response","1.166873000"
"97495","414.501695","192.168.3.103","5.196.78.28","TCP","54","51332  >  1883 [ACK] Seq=15 Ack=2701 Win=251 Len=0","0.047358000"
"97767","418.877296","5.196.78.28","192.168.3.103","MQTT","88","Publish Message [esp32/felipe/dht]","4.375601000"
"97769","418.919198","192.168.3.103","5.196.78.28","TCP","54","51332  >  1883 [ACK] Seq=15 Ack=2735 Win=251 Len=0","0.041902000"
"97829","424.288783","5.196.78.28","192.168.3.103","MQTT","88","Publish Message [esp32/felipe/dht]","5.369585000"
"97830","424.330673","192.168.3.103","5.196.78.28","TCP","54","51332  >  1883 [ACK] Seq=15 Ack=2769 Win=251 Len=0","0.041890000"
"97898","429.518936","5.196.78.28","192.168.3.103","MQTT","88","Publish Message [esp32/felipe/dht]","5.188263000"
"97903","429.564415","192.168.3.103","5.196.78.28","TCP","54","51332  >  1883 [ACK] Seq=15 Ack=2803 Win=251 Len=0","0.045479000"
"97933","434.051640","5.196.78.28","192.168.3.103","MQTT","88","Publish Message [esp32/felipe/dht]","4.487225000"
"97936","434.093113","192.168.3.103","5.196.78.28","TCP","54","51332  >  1883 [ACK] Seq=15 Ack=2837 Win=251 Len=0","0.041473000"
"97977","440.187111","5.196.78.28","192.168.3.103","MQTT","88","Publish Message [esp32/felipe/dht]","6.093998000"
"97978","440.237332","192.168.3.103","5.196.78.28","TCP","54","51332  >  1883 [ACK] Seq=15 Ack=2871 Win=251 Len=0","0.050221000"
"98035","444.937916","5.196.78.28","192.168.3.103","MQTT","88","Publish Message [esp32/felipe/dht]","4.700584000"
"98036","444.979763","192.168.3.103","5.196.78.28","TCP","54","51332  >  1883 [ACK] Seq=15 Ack=2905 Win=251 Len=0","0.041847000"
"98085","449.756721","5.196.78.28","192.168.3.103","MQTT","88","Publish Message [esp32/felipe/dht]","4.776958000"
"98093","449.804492","192.168.3.103","5.196.78.28","TCP","54","51332  >  1883 [ACK] Seq=15 Ack=2939 Win=251 Len=0","0.047771000"
"98159","454.800396","5.196.78.28","192.168.3.103","MQTT","88","Publish Message [esp32/felipe/dht]","4.995904000"
"98160","454.845556","192.168.3.103","5.196.78.28","TCP","54","51332  >  1883 [ACK] Seq=15 Ack=2973 Win=250 Len=0","0.045160000"
"98192","459.943813","5.196.78.28","192.168.3.103","MQTT","88","Publish Message [esp32/felipe/dht]","5.098257000"
"98193","459.992949","192.168.3.103","5.196.78.28","TCP","54","51332  >  1883 [ACK] Seq=15 Ack=3007 Win=250 Len=0","0.049136000"
"98223","465.337585","5.196.78.28","192.168.3.103","MQTT","88","Publish Message [esp32/felipe/dht]","5.344636000"
"98225","465.386981","192.168.3.103","5.196.78.28","TCP","54","51332  >  1883 [ACK] Seq=15 Ack=3041 Win=250 Len=0","0.049396000"
"98275","470.754792","5.196.78.28","192.168.3.103","MQTT","88","Publish Message [esp32/felipe/dht]","5.367811000"
"98276","470.798866","192.168.3.103","5.196.78.28","TCP","54","51332  >  1883 [ACK] Seq=15 Ack=3075 Win=250 Len=0","0.044074000"
"98291","473.784366","192.168.3.103","5.196.78.28","MQTT","56","Ping Request","2.985500000"
"98293","473.998556","5.196.78.28","192.168.3.103","TCP","60","1883  >  51332 [ACK] Seq=3075 Ack=17 Win=502 Len=0","0.214190000"
"98298","474.942780","5.196.78.28","192.168.3.103","MQTT","60","Ping Response","0.944224000"
"98299","474.993289","192.168.3.103","5.196.78.28","TCP","54","51332  >  1883 [ACK] Seq=17 Ack=3077 Win=250 Len=0","0.050509000"
"98311","475.845759","5.196.78.28","192.168.3.103","MQTT","88","Publish Message [esp32/felipe/dht]","0.852470000"
"98312","475.894102","192.168.3.103","5.196.78.28","TCP","54","51332  >  1883 [ACK] Seq=17 Ack=3111 Win=255 Len=0","0.048343000"
"98349","481.128963","5.196.78.28","192.168.3.103","MQTT","88","Publish Message [esp32/felipe/dht]","5.234861000"
"98350","481.181163","192.168.3.103","5.196.78.28","TCP","54","51332  >  1883 [ACK] Seq=17 Ack=3145 Win=255 Len=0","0.052200000"
"98415","487.580249","5.196.78.28","192.168.3.103","MQTT","88","Publish Message [esp32/felipe/dht]","6.399086000"
"98416","487.621623","192.168.3.103","5.196.78.28","TCP","54","51332  >  1883 [ACK] Seq=17 Ack=3179 Win=255 Len=0","0.041374000"
"98446","492.463107","5.196.78.28","192.168.3.103","MQTT","88","Publish Message [esp32/felipe/dht]","4.841484000"
"98448","492.507010","192.168.3.103","5.196.78.28","TCP","54","51332  >  1883 [ACK] Seq=17 Ack=3213 Win=255 Len=0","0.043903000"
"98481","497.318328","5.196.78.28","192.168.3.103","MQTT","88","Publish Message [esp32/felipe/dht]","4.811318000"
"98482","497.370400","192.168.3.103","5.196.78.28","TCP","54","51332  >  1883 [ACK] Seq=17 Ack=3247 Win=255 Len=0","0.052072000"
"98507","502.161519","5.196.78.28","192.168.3.103","MQTT","88","Publish Message [esp32/felipe/dht]","4.791119000"
"98508","502.205300","192.168.3.103","5.196.78.28","TCP","54","51332  >  1883 [ACK] Seq=17 Ack=3281 Win=255 Len=0","0.043781000"
"98534","507.613254","5.196.78.28","192.168.3.103","MQTT","88","Publish Message [esp32/felipe/dht]","5.407954000"
"98535","507.667726","192.168.3.103","5.196.78.28","TCP","54","51332  >  1883 [ACK] Seq=17 Ack=3315 Win=255 Len=0","0.054472000"
"98565","513.279755","5.196.78.28","192.168.3.103","MQTT","88","Publish Message [esp32/felipe/dht]","5.612029000"
"98567","513.325227","192.168.3.103","5.196.78.28","TCP","54","51332  >  1883 [ACK] Seq=17 Ack=3349 Win=255 Len=0","0.045472000"
"98688","518.866862","5.196.78.28","192.168.3.103","MQTT","88","Publish Message [esp32/felipe/dht]","5.541635000"
"98690","518.922579","192.168.3.103","5.196.78.28","TCP","54","51332  >  1883 [ACK] Seq=17 Ack=3383 Win=254 Len=0","0.055717000"
"98744","524.816814","5.196.78.28","192.168.3.103","MQTT","88","Publish Message [esp32/felipe/dht]","5.894235000"
"98745","524.868489","192.168.3.103","5.196.78.28","TCP","54","51332  >  1883 [ACK] Seq=17 Ack=3417 Win=254 Len=0","0.051675000"
"98806","529.634609","5.196.78.28","192.168.3.103","MQTT","88","Publish Message [esp32/felipe/dht]","4.766120000"
"98808","529.677627","192.168.3.103","5.196.78.28","TCP","54","51332  >  1883 [ACK] Seq=17 Ack=3451 Win=254 Len=0","0.043018000"
"98837","534.500472","5.196.78.28","192.168.3.103","MQTT","88","Publish Message [esp32/felipe/dht]","4.822845000"
"98838","534.500788","192.168.3.103","5.196.78.28","MQTT","56","Ping Request","0.000316000"
"98841","534.717904","5.196.78.28","192.168.3.103","TCP","60","1883  >  51332 [ACK] Seq=3485 Ack=19 Win=502 Len=0","0.217116000"
"98858","537.073019","5.196.78.28","192.168.3.103","MQTT","60","Ping Response","2.355115000"
"98859","537.123933","192.168.3.103","5.196.78.28","TCP","54","51332  >  1883 [ACK] Seq=19 Ack=3487 Win=254 Len=0","0.050914000"
"98878","540.467726","5.196.78.28","192.168.3.103","MQTT","88","Publish Message [esp32/felipe/dht]","3.343793000"
"98880","540.509833","192.168.3.103","5.196.78.28","TCP","54","51332  >  1883 [ACK] Seq=19 Ack=3521 Win=254 Len=0","0.042107000"
"98913","544.864274","5.196.78.28","192.168.3.103","MQTT","88","Publish Message [esp32/felipe/dht]","4.354441000"
"98914","544.904817","192.168.3.103","5.196.78.28","TCP","54","51332  >  1883 [ACK] Seq=19 Ack=3555 Win=254 Len=0","0.040543000"
"98989","549.915835","5.196.78.28","192.168.3.103","MQTT","88","Publish Message [esp32/felipe/dht]","5.011018000"
"98993","549.969786","192.168.3.103","5.196.78.28","TCP","54","51332  >  1883 [ACK] Seq=19 Ack=3589 Win=254 Len=0","0.053951000"
"99029","555.790899","5.196.78.28","192.168.3.103","MQTT","88","Publish Message [esp32/felipe/dht]","5.821113000"
"99030","555.834294","192.168.3.103","5.196.78.28","TCP","54","51332  >  1883 [ACK] Seq=19 Ack=3623 Win=253 Len=0","0.043395000"
"99099","560.917149","5.196.78.28","192.168.3.103","MQTT","88","Publish Message [esp32/felipe/dht]","5.082855000"
"99101","560.967413","192.168.3.103","5.196.78.28","TCP","54","51332  >  1883 [ACK] Seq=19 Ack=3657 Win=253 Len=0","0.050264000"
"99150","566.303555","5.196.78.28","192.168.3.103","MQTT","88","Publish Message [esp32/felipe/dht]","5.336142000"
"99151","566.346764","192.168.3.103","5.196.78.28","TCP","54","51332  >  1883 [ACK] Seq=19 Ack=3691 Win=253 Len=0","0.043209000"
"99188","572.432399","5.196.78.28","192.168.3.103","MQTT","88","Publish Message [esp32/felipe/dht]","6.085635000"
"99189","572.483726","192.168.3.103","5.196.78.28","TCP","54","51332  >  1883 [ACK] Seq=19 Ack=3725 Win=253 Len=0","0.051327000"
"99224","577.428560","5.196.78.28","192.168.3.103","MQTT","88","Publish Message [esp32/felipe/dht]","4.944834000"
"99225","577.473204","192.168.3.103","5.196.78.28","TCP","54","51332  >  1883 [ACK] Seq=19 Ack=3759 Win=253 Len=0","0.044644000"
"99249","582.361626","5.196.78.28","192.168.3.103","MQTT","88","Publish Message [esp32/felipe/dht]","4.888422000"
"99250","582.410313","192.168.3.103","5.196.78.28","TCP","54","51332  >  1883 [ACK] Seq=19 Ack=3793 Win=253 Len=0","0.048687000"
"99284","587.351981","5.196.78.28","192.168.3.103","MQTT","88","Publish Message [esp32/felipe/dht]","4.941668000"
"99287","587.401646","192.168.3.103","5.196.78.28","TCP","54","51332  >  1883 [ACK] Seq=19 Ack=3827 Win=253 Len=0","0.049665000"
"99307","592.697085","5.196.78.28","192.168.3.103","MQTT","88","Publish Message [esp32/felipe/dht]","5.295439000"
"99308","592.748011","192.168.3.103","5.196.78.28","TCP","54","51332  >  1883 [ACK] Seq=19 Ack=3861 Win=253 Len=0","0.050926000"
"99317","594.719272","192.168.3.103","5.196.78.28","MQTT","56","Ping Request","1.971261000"
"99318","594.938137","5.196.78.28","192.168.3.103","TCP","60","1883  >  51332 [ACK] Seq=3861 Ack=21 Win=502 Len=0","0.218865000"
"99339","597.820320","5.196.78.28","192.168.3.103","MQTT","60","Ping Response","2.882183000"
"99340","597.874814","192.168.3.103","5.196.78.28","TCP","54","51332  >  1883 [ACK] Seq=21 Ack=3863 Win=253 Len=0","0.054494000"
"99344","598.131864","5.196.78.28","192.168.3.103","MQTT","88","Publish Message [esp32/felipe/dht]","0.257050000"
"99345","598.183791","192.168.3.103","5.196.78.28","TCP","54","51332  >  1883 [ACK] Seq=21 Ack=3897 Win=252 Len=0","0.051927000"
"99442","602.914097","5.196.78.28","192.168.3.103","MQTT","88","Publish Message [esp32/felipe/dht]","4.730306000"
"99449","602.954903","192.168.3.103","5.196.78.28","TCP","54","51332  >  1883 [ACK] Seq=21 Ack=3931 Win=252 Len=0","0.040806000"
"99756","608.817057","5.196.78.28","192.168.3.103","MQTT","88","Publish Message [esp32/felipe/dht]","5.862154000"
"99757","608.866083","192.168.3.103","5.196.78.28","TCP","54","51332  >  1883 [ACK] Seq=21 Ack=3965 Win=252 Len=0","0.049026000"
"99782","613.498458","5.196.78.28","192.168.3.103","MQTT","88","Publish Message [esp32/felipe/dht]","4.632375000"
"99783","613.550098","192.168.3.103","5.196.78.28","TCP","54","51332  >  1883 [ACK] Seq=21 Ack=3999 Win=252 Len=0","0.051640000"
"99811","618.527287","5.196.78.28","192.168.3.103","MQTT","88","Publish Message [esp32/felipe/dht]","4.977189000"
"99812","618.569405","192.168.3.103","5.196.78.28","TCP","54","51332  >  1883 [ACK] Seq=21 Ack=4033 Win=252 Len=0","0.042118000"
"99848","624.613539","5.196.78.28","192.168.3.103","MQTT","88","Publish Message [esp32/felipe/dht]","6.044134000"
"99849","624.654608","192.168.3.103","5.196.78.28","TCP","54","51332  >  1883 [ACK] Seq=21 Ack=4067 Win=252 Len=0","0.041069000"
"99902","629.821157","5.196.78.28","192.168.3.103","MQTT","88","Publish Message [esp32/felipe/dht]","5.166549000"
"99903","629.871836","192.168.3.103","5.196.78.28","TCP","54","51332  >  1883 [ACK] Seq=21 Ack=4101 Win=252 Len=0","0.050679000"
"99924","634.991640","5.196.78.28","192.168.3.103","MQTT","88","Publish Message [esp32/felipe/dht]","5.119804000"
"99926","635.046939","192.168.3.103","5.196.78.28","TCP","54","51332  >  1883 [ACK] Seq=21 Ack=4135 Win=251 Len=0","0.055299000"
"100286","640.238448","5.196.78.28","192.168.3.103","MQTT","88","Publish Message [esp32/felipe/dht]","5.191509000"
"100287","640.286089","192.168.3.103","5.196.78.28","TCP","54","51332  >  1883 [ACK] Seq=21 Ack=4169 Win=251 Len=0","0.047641000"
"100371","645.013018","5.196.78.28","192.168.3.103","MQTT","88","Publish Message [esp32/felipe/dht]","4.726929000"
"100372","645.060568","192.168.3.103","5.196.78.28","TCP","54","51332  >  1883 [ACK] Seq=21 Ack=4203 Win=251 Len=0","0.047550000"
"100407","649.887161","5.196.78.28","192.168.3.103","MQTT","88","Publish Message [esp32/felipe/dht]","4.826593000"
"100408","649.928196","192.168.3.103","5.196.78.28","TCP","54","51332  >  1883 [ACK] Seq=21 Ack=4237 Win=251 Len=0","0.041035000"
"100443","654.922181","192.168.3.103","5.196.78.28","MQTT","56","Ping Request","4.993985000"
"100445","655.140672","5.196.78.28","192.168.3.103","TCP","60","1883  >  51332 [ACK] Seq=4237 Ack=23 Win=502 Len=0","0.218491000"
"100463","655.544489","5.196.78.28","192.168.3.103","MQTT","88","Publish Message [esp32/felipe/dht]","0.403817000"
"100466","655.591850","192.168.3.103","5.196.78.28","TCP","54","51332  >  1883 [ACK] Seq=23 Ack=4271 Win=251 Len=0","0.047361000"
"100495","656.406000","5.196.78.28","192.168.3.103","MQTT","60","Ping Response","0.814150000"
"100496","656.460902","192.168.3.103","5.196.78.28","TCP","54","51332  >  1883 [ACK] Seq=23 Ack=4273 Win=251 Len=0","0.054902000"
"100537","660.944659","5.196.78.28","192.168.3.103","MQTT","88","Publish Message [esp32/felipe/dht]","4.483757000"
"100539","660.988128","192.168.3.103","5.196.78.28","TCP","54","51332  >  1883 [ACK] Seq=23 Ack=4307 Win=251 Len=0","0.043469000"
"100579","666.672302","5.196.78.28","192.168.3.103","MQTT","88","Publish Message [esp32/felipe/dht]","5.684174000"
"100580","666.716612","192.168.3.103","5.196.78.28","TCP","54","51332  >  1883 [ACK] Seq=23 Ack=4341 Win=251 Len=0","0.044310000"
"100607","671.281861","5.196.78.28","192.168.3.103","MQTT","88","Publish Message [esp32/felipe/dht]","4.565249000"
"100610","671.330896","192.168.3.103","5.196.78.28","TCP","54","51332  >  1883 [ACK] Seq=23 Ack=4375 Win=251 Len=0","0.049035000"
"100671","676.573374","5.196.78.28","192.168.3.103","MQTT","88","Publish Message [esp32/felipe/dht]","5.242478000"
"100672","676.625981","192.168.3.103","5.196.78.28","TCP","54","51332  >  1883 [ACK] Seq=23 Ack=4409 Win=250 Len=0","0.052607000"
"100905","681.912848","5.196.78.28","192.168.3.103","MQTT","88","Publish Message [esp32/felipe/dht]","5.286867000"
"100907","681.965908","192.168.3.103","5.196.78.28","TCP","54","51332  >  1883 [ACK] Seq=23 Ack=4443 Win=250 Len=0","0.053060000"
"100966","686.967673","5.196.78.28","192.168.3.103","MQTT","88","Publish Message [esp32/felipe/dht]","5.001765000"
"100968","687.010940","192.168.3.103","5.196.78.28","TCP","54","51332  >  1883 [ACK] Seq=23 Ack=4477 Win=250 Len=0","0.043267000"
"101004","692.534549","5.196.78.28","192.168.3.103","MQTT","88","Publish Message [esp32/felipe/dht]","5.523609000"
"101005","692.574948","192.168.3.103","5.196.78.28","TCP","54","51332  >  1883 [ACK] Seq=23 Ack=4511 Win=250 Len=0","0.040399000"
"101039","697.552692","5.196.78.28","192.168.3.103","MQTT","88","Publish Message [esp32/felipe/dht]","4.977744000"
"101043","697.600215","192.168.3.103","5.196.78.28","TCP","54","51332  >  1883 [ACK] Seq=23 Ack=4545 Win=255 Len=0","0.047523000"
"101074","703.347601","5.196.78.28","192.168.3.103","MQTT","88","Publish Message [esp32/felipe/dht]","5.747386000"
"101078","703.400021","192.168.3.103","5.196.78.28","TCP","54","51332  >  1883 [ACK] Seq=23 Ack=4579 Win=255 Len=0","0.052420000"
"101147","708.948645","5.196.78.28","192.168.3.103","MQTT","88","Publish Message [esp32/felipe/dht]","5.548624000"
"101148","708.992832","192.168.3.103","5.196.78.28","TCP","54","51332  >  1883 [ACK] Seq=23 Ack=4613 Win=255 Len=0","0.044187000"
"101182","713.531838","5.196.78.28","192.168.3.103","MQTT","88","Publish Message [esp32/felipe/dht]","4.539006000"
"101185","713.578823","192.168.3.103","5.196.78.28","TCP","54","51332  >  1883 [ACK] Seq=23 Ack=4647 Win=255 Len=0","0.046985000"
"101195","715.546455","192.168.3.103","5.196.78.28","MQTT","56","Ping Request","1.967632000"
"101202","715.763758","5.196.78.28","192.168.3.103","TCP","60","1883  >  51332 [ACK] Seq=4647 Ack=25 Win=502 Len=0","0.217303000"
"101212","717.303737","5.196.78.28","192.168.3.103","MQTT","60","Ping Response","1.539979000"
"101213","717.349417","192.168.3.103","5.196.78.28","TCP","54","51332  >  1883 [ACK] Seq=25 Ack=4649 Win=255 Len=0","0.045680000"
"101220","718.495022","5.196.78.28","192.168.3.103","MQTT","88","Publish Message [esp32/felipe/dht]","1.145605000"
"101221","718.543741","192.168.3.103","5.196.78.28","TCP","54","51332  >  1883 [ACK] Seq=25 Ack=4683 Win=255 Len=0","0.048719000"
"101260","723.654459","5.196.78.28","192.168.3.103","MQTT","88","Publish Message [esp32/felipe/dht]","5.110718000"
"101261","723.699207","192.168.3.103","5.196.78.28","TCP","54","51332  >  1883 [ACK] Seq=25 Ack=4717 Win=255 Len=0","0.044748000"
"101320","730.084305","5.196.78.28","192.168.3.103","MQTT","88","Publish Message [esp32/felipe/dht]","6.385098000"
"101321","730.134808","192.168.3.103","5.196.78.28","TCP","54","51332  >  1883 [ACK] Seq=25 Ack=4751 Win=255 Len=0","0.050503000"
"101355","735.203998","5.196.78.28","192.168.3.103","MQTT","88","Publish Message [esp32/felipe/dht]","5.069190000"
"101356","735.248708","192.168.3.103","5.196.78.28","TCP","54","51332  >  1883 [ACK] Seq=25 Ack=4785 Win=255 Len=0","0.044710000"
"101381","739.632620","5.196.78.28","192.168.3.103","MQTT","88","Publish Message [esp32/felipe/dht]","4.383912000"
"101383","739.679749","192.168.3.103","5.196.78.28","TCP","54","51332  >  1883 [ACK] Seq=25 Ack=4819 Win=254 Len=0","0.047129000"
"101443","745.291530","5.196.78.28","192.168.3.103","MQTT","88","Publish Message [esp32/felipe/dht]","5.611781000"
"101444","745.333386","192.168.3.103","5.196.78.28","TCP","54","51332  >  1883 [ACK] Seq=25 Ack=4853 Win=254 Len=0","0.041856000"
"101492","751.014041","5.196.78.28","192.168.3.103","MQTT","88","Publish Message [esp32/felipe/dht]","5.680655000"
"101493","751.057475","192.168.3.103","5.196.78.28","TCP","54","51332  >  1883 [ACK] Seq=25 Ack=4887 Win=254 Len=0","0.043434000"
"101603","756.113885","5.196.78.28","192.168.3.103","MQTT","88","Publish Message [esp32/felipe/dht]","5.056410000"
"101606","756.163682","192.168.3.103","5.196.78.28","TCP","54","51332  >  1883 [ACK] Seq=25 Ack=4921 Win=254 Len=0","0.049797000"
"101648","761.461632","5.196.78.28","192.168.3.103","MQTT","88","Publish Message [esp32/felipe/dht]","5.297950000"
"101649","761.514307","192.168.3.103","5.196.78.28","TCP","54","51332  >  1883 [ACK] Seq=25 Ack=4955 Win=254 Len=0","0.052675000"
"101707","766.457666","5.196.78.28","192.168.3.103","MQTT","88","Publish Message [esp32/felipe/dht]","4.943359000"
"101708","766.508964","192.168.3.103","5.196.78.28","TCP","54","51332  >  1883 [ACK] Seq=25 Ack=4989 Win=254 Len=0","0.051298000"
"102418","772.228231","5.196.78.28","192.168.3.103","MQTT","88","Publish Message [esp32/felipe/dht]","5.719267000"
"102420","772.279658","192.168.3.103","5.196.78.28","TCP","54","51332  >  1883 [ACK] Seq=25 Ack=5023 Win=254 Len=0","0.051427000"
"102443","776.253098","192.168.3.103","5.196.78.28","MQTT","56","Ping Request","3.973440000"
"102446","776.470252","5.196.78.28","192.168.3.103","TCP","60","1883  >  51332 [ACK] Seq=5023 Ack=27 Win=502 Len=0","0.217154000"
"102451","776.763093","5.196.78.28","192.168.3.103","MQTT","88","Publish Message [esp32/felipe/dht]","0.292841000"
"102452","776.812737","192.168.3.103","5.196.78.28","TCP","54","51332  >  1883 [ACK] Seq=27 Ack=5057 Win=253 Len=0","0.049644000"
"102456","777.732605","5.196.78.28","192.168.3.103","MQTT","60","Ping Response","0.919868000"
"102457","777.778919","192.168.3.103","5.196.78.28","TCP","54","51332  >  1883 [ACK] Seq=27 Ack=5059 Win=253 Len=0","0.046314000"
"102496","782.026919","5.196.78.28","192.168.3.103","MQTT","88","Publish Message [esp32/felipe/dht]","4.248000000"
"102498","782.077180","192.168.3.103","5.196.78.28","TCP","54","51332  >  1883 [ACK] Seq=27 Ack=5093 Win=253 Len=0","0.050261000"
"102538","787.152749","5.196.78.28","192.168.3.103","MQTT","88","Publish Message [esp32/felipe/dht]","5.075569000"
"102539","787.206995","192.168.3.103","5.196.78.28","TCP","54","51332  >  1883 [ACK] Seq=27 Ack=5127 Win=253 Len=0","0.054246000"
"102577","792.593614","5.196.78.28","192.168.3.103","MQTT","88","Publish Message [esp32/felipe/dht]","5.386619000"
"102578","792.643776","192.168.3.103","5.196.78.28","TCP","54","51332  >  1883 [ACK] Seq=27 Ack=5161 Win=253 Len=0","0.050162000"
"102607","798.220409","5.196.78.28","192.168.3.103","MQTT","88","Publish Message [esp32/felipe/dht]","5.576633000"
"102608","798.271846","192.168.3.103","5.196.78.28","TCP","54","51332  >  1883 [ACK] Seq=27 Ack=5195 Win=253 Len=0","0.051437000"
"102665","803.684458","5.196.78.28","192.168.3.103","MQTT","88","Publish Message [esp32/felipe/dht]","5.412612000"
"102666","803.735228","192.168.3.103","5.196.78.28","TCP","54","51332  >  1883 [ACK] Seq=27 Ack=5229 Win=253 Len=0","0.050770000"
"102712","808.893599","5.196.78.28","192.168.3.103","MQTT","88","Publish Message [esp32/felipe/dht]","5.158371000"
"102714","808.941793","192.168.3.103","5.196.78.28","TCP","54","51332  >  1883 [ACK] Seq=27 Ack=5263 Win=253 Len=0","0.048194000"
"102748","814.423028","5.196.78.28","192.168.3.103","MQTT","88","Publish Message [esp32/felipe/dht]","5.481235000"
"102749","814.465897","192.168.3.103","5.196.78.28","TCP","54","51332  >  1883 [ACK] Seq=27 Ack=5297 Win=253 Len=0","0.042869000"
"102819","819.335018","5.196.78.28","192.168.3.103","MQTT","88","Publish Message [esp32/felipe/dht]","4.869121000"
"102820","819.380055","192.168.3.103","5.196.78.28","TCP","54","51332  >  1883 [ACK] Seq=27 Ack=5331 Win=252 Len=0","0.045037000"
"102880","824.602897","5.196.78.28","192.168.3.103","MQTT","88","Publish Message [esp32/felipe/dht]","5.222842000"
"102881","824.647088","192.168.3.103","5.196.78.28","TCP","54","51332  >  1883 [ACK] Seq=27 Ack=5365 Win=252 Len=0","0.044191000"
"102959","829.453338","5.196.78.28","192.168.3.103","MQTT","88","Publish Message [esp32/felipe/dht]","4.806250000"
"102968","829.504720","192.168.3.103","5.196.78.28","TCP","54","51332  >  1883 [ACK] Seq=27 Ack=5399 Win=252 Len=0","0.051382000"
"103134","834.954038","5.196.78.28","192.168.3.103","MQTT","88","Publish Message [esp32/felipe/dht]","5.449318000"
"103135","835.000726","192.168.3.103","5.196.78.28","TCP","54","51332  >  1883 [ACK] Seq=27 Ack=5433 Win=252 Len=0","0.046688000"
"103147","836.977537","192.168.3.103","5.196.78.28","MQTT","56","Ping Request","1.976811000"
"103150","837.193552","5.196.78.28","192.168.3.103","TCP","60","1883  >  51332 [ACK] Seq=5433 Ack=29 Win=502 Len=0","0.216015000"
"103185","838.802515","5.196.78.28","192.168.3.103","MQTT","60","Ping Response","1.608963000"
"103186","838.858361","192.168.3.103","5.196.78.28","TCP","54","51332  >  1883 [ACK] Seq=29 Ack=5435 Win=252 Len=0","0.055846000"
"103210","840.373814","5.196.78.28","192.168.3.103","MQTT","88","Publish Message [esp32/felipe/dht]","1.515453000"
"103217","840.416509","192.168.3.103","5.196.78.28","TCP","54","51332  >  1883 [ACK] Seq=29 Ack=5469 Win=252 Len=0","0.042695000"
"103260","845.460746","5.196.78.28","192.168.3.103","MQTT","88","Publish Message [esp32/felipe/dht]","5.044237000"
"103261","845.502322","192.168.3.103","5.196.78.28","TCP","54","51332  >  1883 [ACK] Seq=29 Ack=5503 Win=252 Len=0","0.041576000"
"103302","851.297428","5.196.78.28","192.168.3.103","MQTT","88","Publish Message [esp32/felipe/dht]","5.795106000"
"103304","851.347927","192.168.3.103","5.196.78.28","TCP","54","51332  >  1883 [ACK] Seq=29 Ack=5537 Win=252 Len=0","0.050499000"
"103352","856.326926","5.196.78.28","192.168.3.103","MQTT","88","Publish Message [esp32/felipe/dht]","4.978999000"
"103353","856.372554","192.168.3.103","5.196.78.28","TCP","54","51332  >  1883 [ACK] Seq=29 Ack=5571 Win=251 Len=0","0.045628000"
"103395","861.478197","5.196.78.28","192.168.3.103","MQTT","88","Publish Message [esp32/felipe/dht]","5.105643000"
"103396","861.521954","192.168.3.103","5.196.78.28","TCP","54","51332  >  1883 [ACK] Seq=29 Ack=5605 Win=251 Len=0","0.043757000"
"103430","866.624564","5.196.78.28","192.168.3.103","MQTT","88","Publish Message [esp32/felipe/dht]","5.102610000"
"103432","866.666952","192.168.3.103","5.196.78.28","TCP","54","51332  >  1883 [ACK] Seq=29 Ack=5639 Win=251 Len=0","0.042388000"
"103469","871.669303","5.196.78.28","192.168.3.103","MQTT","88","Publish Message [esp32/felipe/dht]","5.002351000"
"103470","871.723797","192.168.3.103","5.196.78.28","TCP","54","51332  >  1883 [ACK] Seq=29 Ack=5673 Win=251 Len=0","0.054494000"
"103587","876.925855","5.196.78.28","192.168.3.103","MQTT","88","Publish Message [esp32/felipe/dht]","5.202058000"
"103588","876.973576","192.168.3.103","5.196.78.28","TCP","54","51332  >  1883 [ACK] Seq=29 Ack=5707 Win=251 Len=0","0.047721000"
"103636","882.352215","5.196.78.28","192.168.3.103","MQTT","88","Publish Message [esp32/felipe/dht]","5.378639000"
"103637","882.397395","192.168.3.103","5.196.78.28","TCP","54","51332  >  1883 [ACK] Seq=29 Ack=5741 Win=251 Len=0","0.045180000"
"103697","887.732594","5.196.78.28","192.168.3.103","MQTT","88","Publish Message [esp32/felipe/dht]","5.335199000"
"103700","887.778666","192.168.3.103","5.196.78.28","TCP","54","51332  >  1883 [ACK] Seq=29 Ack=5775 Win=251 Len=0","0.046072000"
"103774","892.984594","5.196.78.28","192.168.3.103","MQTT","88","Publish Message [esp32/felipe/dht]","5.205928000"
"103776","893.034476","192.168.3.103","5.196.78.28","TCP","54","51332  >  1883 [ACK] Seq=29 Ack=5809 Win=251 Len=0","0.049882000"
"103960","897.025602","192.168.3.103","5.196.78.28","MQTT","56","Ping Request","3.991126000"
"103966","897.245967","5.196.78.28","192.168.3.103","TCP","60","1883  >  51332 [ACK] Seq=5809 Ack=31 Win=502 Len=0","0.220365000"
"103975","898.134118","5.196.78.28","192.168.3.103","MQTT","88","Publish Message [esp32/felipe/dht]","0.888151000"
"103976","898.187333","192.168.3.103","5.196.78.28","TCP","54","51332  >  1883 [ACK] Seq=31 Ack=5843 Win=250 Len=0","0.053215000"
"103981","898.250962","5.196.78.28","192.168.3.103","MQTT","60","Ping Response","0.063629000"
"103983","898.296352","192.168.3.103","5.196.78.28","TCP","54","51332  >  1883 [ACK] Seq=31 Ack=5845 Win=250 Len=0","0.045390000"
"104636","903.623485","5.196.78.28","192.168.3.103","MQTT","88","Publish Message [esp32/felipe/dht]","5.327133000"
"104637","903.669473","192.168.3.103","5.196.78.28","TCP","54","51332  >  1883 [ACK] Seq=31 Ack=5879 Win=250 Len=0","0.045988000"
"105011","908.378211","5.196.78.28","192.168.3.103","MQTT","88","Publish Message [esp32/felipe/dht]","4.708738000"
"105012","908.430684","192.168.3.103","5.196.78.28","TCP","54","51332  >  1883 [ACK] Seq=31 Ack=5913 Win=250 Len=0","0.052473000"
"105046","913.679949","5.196.78.28","192.168.3.103","MQTT","88","Publish Message [esp32/felipe/dht]","5.249265000"
"105047","913.722752","192.168.3.103","5.196.78.28","TCP","54","51332  >  1883 [ACK] Seq=31 Ack=5947 Win=250 Len=0","0.042803000"
"105083","919.309260","5.196.78.28","192.168.3.103","MQTT","88","Publish Message [esp32/felipe/dht]","5.586508000"
"105084","919.358736","192.168.3.103","5.196.78.28","TCP","54","51332  >  1883 [ACK] Seq=31 Ack=5981 Win=255 Len=0","0.049476000"
"105413","924.594875","5.196.78.28","192.168.3.103","MQTT","88","Publish Message [esp32/felipe/dht]","5.236139000"
"105415","924.643282","192.168.3.103","5.196.78.28","TCP","54","51332  >  1883 [ACK] Seq=31 Ack=6015 Win=255 Len=0","0.048407000"
"105450","929.568348","5.196.78.28","192.168.3.103","MQTT","88","Publish Message [esp32/felipe/dht]","4.925066000"
"105453","929.617865","192.168.3.103","5.196.78.28","TCP","54","51332  >  1883 [ACK] Seq=31 Ack=6049 Win=255 Len=0","0.049517000"
"105507","934.805913","5.196.78.28","192.168.3.103","MQTT","88","Publish Message [esp32/felipe/dht]","5.188048000"
"105508","934.858361","192.168.3.103","5.196.78.28","TCP","54","51332  >  1883 [ACK] Seq=31 Ack=6083 Win=255 Len=0","0.052448000"
"105702","939.748933","5.196.78.28","192.168.3.103","MQTT","88","Publish Message [esp32/felipe/dht]","4.890572000"
"105704","939.794820","192.168.3.103","5.196.78.28","TCP","54","51332  >  1883 [ACK] Seq=31 Ack=6117 Win=255 Len=0","0.045887000"
"105787","945.437299","5.196.78.28","192.168.3.103","MQTT","88","Publish Message [esp32/felipe/dht]","5.642479000"
"105788","945.477807","192.168.3.103","5.196.78.28","TCP","54","51332  >  1883 [ACK] Seq=31 Ack=6151 Win=255 Len=0","0.040508000"
"105851","951.119214","5.196.78.28","192.168.3.103","MQTT","88","Publish Message [esp32/felipe/dht]","5.641407000"
"105852","951.163289","192.168.3.103","5.196.78.28","TCP","54","51332  >  1883 [ACK] Seq=31 Ack=6185 Win=255 Len=0","0.044075000"
"105947","955.972382","5.196.78.28","192.168.3.103","MQTT","88","Publish Message [esp32/felipe/dht]","4.809093000"
"105949","956.019515","192.168.3.103","5.196.78.28","TCP","54","51332  >  1883 [ACK] Seq=31 Ack=6219 Win=255 Len=0","0.047133000"
"105962","957.986192","192.168.3.103","5.196.78.28","MQTT","56","Ping Request","1.966677000"
"105963","958.201312","5.196.78.28","192.168.3.103","TCP","60","1883  >  51332 [ACK] Seq=6219 Ack=33 Win=502 Len=0","0.215120000"
"105971","959.414347","5.196.78.28","192.168.3.103","MQTT","60","Ping Response","1.213035000"
"105972","959.463369","192.168.3.103","5.196.78.28","TCP","54","51332  >  1883 [ACK] Seq=33 Ack=6221 Win=255 Len=0","0.049022000"
"106007","961.403342","5.196.78.28","192.168.3.103","MQTT","88","Publish Message [esp32/felipe/dht]","1.939973000"
"106008","961.455307","192.168.3.103","5.196.78.28","TCP","54","51332  >  1883 [ACK] Seq=33 Ack=6255 Win=254 Len=0","0.051965000"
"106080","966.845900","5.196.78.28","192.168.3.103","MQTT","88","Publish Message [esp32/felipe/dht]","5.390593000"
"106082","966.888040","192.168.3.103","5.196.78.28","TCP","54","51332  >  1883 [ACK] Seq=33 Ack=6289 Win=254 Len=0","0.042140000"
"106244","972.307543","5.196.78.28","192.168.3.103","MQTT","88","Publish Message [esp32/felipe/dht]","5.419503000"
"106245","972.348237","192.168.3.103","5.196.78.28","TCP","54","51332  >  1883 [ACK] Seq=33 Ack=6323 Win=254 Len=0","0.040694000"
"106291","977.236069","5.196.78.28","192.168.3.103","MQTT","88","Publish Message [esp32/felipe/dht]","4.887832000"
"106295","977.282247","192.168.3.103","5.196.78.28","TCP","54","51332  >  1883 [ACK] Seq=33 Ack=6357 Win=254 Len=0","0.046178000"
"106700","982.681506","5.196.78.28","192.168.3.103","MQTT","88","Publish Message [esp32/felipe/dht]","5.399259000"
"106713","982.732850","192.168.3.103","5.196.78.28","TCP","54","51332  >  1883 [ACK] Seq=33 Ack=6391 Win=254 Len=0","0.051344000"
"111837","987.759717","5.196.78.28","192.168.3.103","MQTT","88","Publish Message [esp32/felipe/dht]","5.026867000"
"111855","987.807780","192.168.3.103","5.196.78.28","TCP","54","51332  >  1883 [ACK] Seq=33 Ack=6425 Win=254 Len=0","0.048063000"
"113609","993.210865","5.196.78.28","192.168.3.103","MQTT","88","Publish Message [esp32/felipe/dht]","5.403085000"
"113611","993.261137","192.168.3.103","5.196.78.28","TCP","54","51332  >  1883 [ACK] Seq=33 Ack=6459 Win=254 Len=0","0.050272000"
"114823","998.222660","5.196.78.28","192.168.3.103","MQTT","88","Publish Message [esp32/felipe/dht]","4.961523000"
"114832","998.277755","192.168.3.103","5.196.78.28","TCP","54","51332  >  1883 [ACK] Seq=33 Ack=6493 Win=253 Len=0","0.055095000"
"115518","1003.483956","5.196.78.28","192.168.3.103","MQTT","88","Publish Message [esp32/felipe/dht]","5.206201000"
"115519","1003.523790","192.168.3.103","5.196.78.28","TCP","54","51332  >  1883 [ACK] Seq=33 Ack=6527 Win=253 Len=0","0.039834000"
"115769","1008.680825","5.196.78.28","192.168.3.103","MQTT","88","Publish Message [esp32/felipe/dht]","5.157035000"
"115772","1008.727428","192.168.3.103","5.196.78.28","TCP","54","51332  >  1883 [ACK] Seq=33 Ack=6561 Win=253 Len=0","0.046603000"
"116768","1014.496386","5.196.78.28","192.168.3.103","MQTT","88","Publish Message [esp32/felipe/dht]","5.768958000"
"116769","1014.536476","192.168.3.103","5.196.78.28","TCP","54","51332  >  1883 [ACK] Seq=33 Ack=6595 Win=253 Len=0","0.040090000"
"117369","1018.541511","192.168.3.103","5.196.78.28","MQTT","56","Ping Request","4.005035000"
"117371","1018.756516","5.196.78.28","192.168.3.103","TCP","60","1883  >  51332 [ACK] Seq=6595 Ack=35 Win=502 Len=0","0.215005000"
"117616","1019.648666","5.196.78.28","192.168.3.103","MQTT","88","Publish Message [esp32/felipe/dht]","0.892150000"
"117618","1019.688949","192.168.3.103","5.196.78.28","TCP","54","51332  >  1883 [ACK] Seq=35 Ack=6629 Win=253 Len=0","0.040283000"
"117620","1019.835200","5.196.78.28","192.168.3.103","MQTT","60","Ping Response","0.146251000"
"117621","1019.889349","192.168.3.103","5.196.78.28","TCP","54","51332  >  1883 [ACK] Seq=35 Ack=6631 Win=253 Len=0","0.054149000"
"119702","1025.018011","5.196.78.28","192.168.3.103","MQTT","88","Publish Message [esp32/felipe/dht]","5.128662000"
"119703","1025.062796","192.168.3.103","5.196.78.28","TCP","54","51332  >  1883 [ACK] Seq=35 Ack=6665 Win=253 Len=0","0.044785000"
"120310","1030.301594","5.196.78.28","192.168.3.103","MQTT","88","Publish Message [esp32/felipe/dht]","5.238798000"
"120312","1030.348202","192.168.3.103","5.196.78.28","TCP","54","51332  >  1883 [ACK] Seq=35 Ack=6699 Win=253 Len=0","0.046608000"
"121628","1035.198353","5.196.78.28","192.168.3.103","MQTT","88","Publish Message [esp32/felipe/dht]","4.850151000"
"121630","1035.242738","192.168.3.103","5.196.78.28","TCP","54","51332  >  1883 [ACK] Seq=35 Ack=6733 Win=253 Len=0","0.044385000"
"122245","1040.527598","5.196.78.28","192.168.3.103","MQTT","88","Publish Message [esp32/felipe/dht]","5.284860000"
"122249","1040.579578","192.168.3.103","5.196.78.28","TCP","54","51332  >  1883 [ACK] Seq=35 Ack=6767 Win=252 Len=0","0.051980000"
"122935","1046.032481","5.196.78.28","192.168.3.103","MQTT","88","Publish Message [esp32/felipe/dht]","5.452903000"
"122936","1046.086205","192.168.3.103","5.196.78.28","TCP","54","51332  >  1883 [ACK] Seq=35 Ack=6801 Win=252 Len=0","0.053724000"
"123249","1051.312874","5.196.78.28","192.168.3.103","MQTT","88","Publish Message [esp32/felipe/dht]","5.226669000"
"123301","1051.353967","192.168.3.103","5.196.78.28","TCP","54","51332  >  1883 [ACK] Seq=35 Ack=6835 Win=252 Len=0","0.041093000"
"123513","1056.621024","5.196.78.28","192.168.3.103","MQTT","88","Publish Message [esp32/felipe/dht]","5.267057000"
"123514","1056.666543","192.168.3.103","5.196.78.28","TCP","54","51332  >  1883 [ACK] Seq=35 Ack=6869 Win=252 Len=0","0.045519000"
"123552","1062.011859","5.196.78.28","192.168.3.103","MQTT","88","Publish Message [esp32/felipe/dht]","5.345316000"
"123553","1062.061786","192.168.3.103","5.196.78.28","TCP","54","51332  >  1883 [ACK] Seq=35 Ack=6903 Win=252 Len=0","0.049927000"
"123594","1067.598151","5.196.78.28","192.168.3.103","MQTT","88","Publish Message [esp32/felipe/dht]","5.536365000"
"123595","1067.648959","192.168.3.103","5.196.78.28","TCP","54","51332  >  1883 [ACK] Seq=35 Ack=6937 Win=252 Len=0","0.050808000"
"123630","1072.678060","5.196.78.28","192.168.3.103","MQTT","88","Publish Message [esp32/felipe/dht]","5.029101000"
"123631","1072.720294","192.168.3.103","5.196.78.28","TCP","54","51332  >  1883 [ACK] Seq=35 Ack=6971 Win=252 Len=0","0.042234000"
"123706","1077.902815","5.196.78.28","192.168.3.103","MQTT","88","Publish Message [esp32/felipe/dht]","5.182521000"
"123707","1077.951562","192.168.3.103","5.196.78.28","TCP","54","51332  >  1883 [ACK] Seq=35 Ack=7005 Win=251 Len=0","0.048747000"
"123711","1078.914210","192.168.3.103","5.196.78.28","MQTT","56","Ping Request","0.962648000"
"123714","1079.131760","5.196.78.28","192.168.3.103","TCP","60","1883  >  51332 [ACK] Seq=7005 Ack=37 Win=502 Len=0","0.217550000"
"123727","1080.604900","5.196.78.28","192.168.3.103","MQTT","60","Ping Response","1.473140000"
"123730","1080.646774","192.168.3.103","5.196.78.28","TCP","54","51332  >  1883 [ACK] Seq=37 Ack=7007 Win=251 Len=0","0.041874000"
"123746","1082.770758","5.196.78.28","192.168.3.103","MQTT","88","Publish Message [esp32/felipe/dht]","2.123984000"
"123747","1082.819006","192.168.3.103","5.196.78.28","TCP","54","51332  >  1883 [ACK] Seq=37 Ack=7041 Win=251 Len=0","0.048248000"
"123781","1088.005360","5.196.78.28","192.168.3.103","MQTT","88","Publish Message [esp32/felipe/dht]","5.186354000"
"123782","1088.055546","192.168.3.103","5.196.78.28","TCP","54","51332  >  1883 [ACK] Seq=37 Ack=7075 Win=251 Len=0","0.050186000"
"123828","1093.688672","5.196.78.28","192.168.3.103","MQTT","88","Publish Message [esp32/felipe/dht]","5.633126000"
"123829","1093.736142","192.168.3.103","5.196.78.28","TCP","54","51332  >  1883 [ACK] Seq=37 Ack=7109 Win=251 Len=0","0.047470000"
"123876","1098.832458","5.196.78.28","192.168.3.103","MQTT","88","Publish Message [esp32/felipe/dht]","5.096316000"
"123877","1098.886481","192.168.3.103","5.196.78.28","TCP","54","51332  >  1883 [ACK] Seq=37 Ack=7143 Win=251 Len=0","0.054023000"
"123930","1104.663405","5.196.78.28","192.168.3.103","MQTT","88","Publish Message [esp32/felipe/dht]","5.776924000"
"123931","1104.706287","192.168.3.103","5.196.78.28","TCP","54","51332  >  1883 [ACK] Seq=37 Ack=7177 Win=251 Len=0","0.042882000"
"123970","1109.127449","5.196.78.28","192.168.3.103","MQTT","88","Publish Message [esp32/felipe/dht]","4.421162000"
"123971","1109.175978","192.168.3.103","5.196.78.28","TCP","54","51332  >  1883 [ACK] Seq=37 Ack=7211 Win=251 Len=0","0.048529000"
"124001","1114.548213","5.196.78.28","192.168.3.103","MQTT","88","Publish Message [esp32/felipe/dht]","5.372235000"
"124002","1114.602653","192.168.3.103","5.196.78.28","TCP","54","51332  >  1883 [ACK] Seq=37 Ack=7245 Win=251 Len=0","0.054440000"
"124047","1120.387498","5.196.78.28","192.168.3.103","MQTT","88","Publish Message [esp32/felipe/dht]","5.784845000"
"124050","1120.436970","192.168.3.103","5.196.78.28","TCP","54","51332  >  1883 [ACK] Seq=37 Ack=7279 Win=250 Len=0","0.049472000"
"124083","1124.850484","5.196.78.28","192.168.3.103","MQTT","88","Publish Message [esp32/felipe/dht]","4.413514000"
"124084","1124.898353","192.168.3.103","5.196.78.28","TCP","54","51332  >  1883 [ACK] Seq=37 Ack=7313 Win=250 Len=0","0.047869000"
"124130","1130.551689","5.196.78.28","192.168.3.103","MQTT","88","Publish Message [esp32/felipe/dht]","5.653336000"
"124131","1130.599772","192.168.3.103","5.196.78.28","TCP","54","51332  >  1883 [ACK] Seq=37 Ack=7347 Win=250 Len=0","0.048083000"
"124160","1135.513756","5.196.78.28","192.168.3.103","MQTT","88","Publish Message [esp32/felipe/dht]","4.913984000"
"124161","1135.567844","192.168.3.103","5.196.78.28","TCP","54","51332  >  1883 [ACK] Seq=37 Ack=7381 Win=250 Len=0","0.054088000"
"124186","1139.545503","192.168.3.103","5.196.78.28","MQTT","56","Ping Request","3.977659000"
"124191","1139.762986","5.196.78.28","192.168.3.103","TCP","60","1883  >  51332 [ACK] Seq=7381 Ack=39 Win=502 Len=0","0.217483000"
"124196","1140.796243","5.196.78.28","192.168.3.103","MQTT","88","Publish Message [esp32/felipe/dht]","1.033257000"
"124200","1140.850803","192.168.3.103","5.196.78.28","TCP","54","51332  >  1883 [ACK] Seq=39 Ack=7415 Win=255 Len=0","0.054560000"
"124205","1141.497979","5.196.78.28","192.168.3.103","MQTT","60","Ping Response","0.647176000"
"124206","1141.547945","192.168.3.103","5.196.78.28","TCP","54","51332  >  1883 [ACK] Seq=39 Ack=7417 Win=255 Len=0","0.049966000"
"124244","1146.496745","5.196.78.28","192.168.3.103","MQTT","88","Publish Message [esp32/felipe/dht]","4.948800000"
"124245","1146.541845","192.168.3.103","5.196.78.28","TCP","54","51332  >  1883 [ACK] Seq=39 Ack=7451 Win=255 Len=0","0.045100000"
"124273","1151.221160","5.196.78.28","192.168.3.103","MQTT","88","Publish Message [esp32/felipe/dht]","4.679315000"
"124274","1151.275313","192.168.3.103","5.196.78.28","TCP","54","51332  >  1883 [ACK] Seq=39 Ack=7485 Win=255 Len=0","0.054153000"
"124311","1157.026155","5.196.78.28","192.168.3.103","MQTT","88","Publish Message [esp32/felipe/dht]","5.750842000"
"124312","1157.071562","192.168.3.103","5.196.78.28","TCP","54","51332  >  1883 [ACK] Seq=39 Ack=7519 Win=255 Len=0","0.045407000"
"124351","1162.284798","5.196.78.28","192.168.3.103","MQTT","88","Publish Message [esp32/felipe/dht]","5.213236000"
"124354","1162.339060","192.168.3.103","5.196.78.28","TCP","54","51332  >  1883 [ACK] Seq=39 Ack=7553 Win=255 Len=0","0.054262000"
"124403","1167.854260","5.196.78.28","192.168.3.103","MQTT","88","Publish Message [esp32/felipe/dht]","5.515200000"
"124405","1167.895724","192.168.3.103","5.196.78.28","TCP","54","51332  >  1883 [ACK] Seq=39 Ack=7587 Win=255 Len=0","0.041464000"
"124450","1173.449001","5.196.78.28","192.168.3.103","MQTT","88","Publish Message [esp32/felipe/dht]","5.553277000"
"124451","1173.488914","192.168.3.103","5.196.78.28","TCP","54","51332  >  1883 [ACK] Seq=39 Ack=7621 Win=255 Len=0","0.039913000"
"124486","1178.076467","5.196.78.28","192.168.3.103","MQTT","88","Publish Message [esp32/felipe/dht]","4.587553000"
"124488","1178.130986","192.168.3.103","5.196.78.28","TCP","54","51332  >  1883 [ACK] Seq=39 Ack=7655 Win=255 Len=0","0.054519000"
"124526","1183.315841","5.196.78.28","192.168.3.103","MQTT","88","Publish Message [esp32/felipe/dht]","5.184855000"
"124527","1183.357219","192.168.3.103","5.196.78.28","TCP","54","51332  >  1883 [ACK] Seq=39 Ack=7689 Win=254 Len=0","0.041378000"
"124593","1188.513204","5.196.78.28","192.168.3.103","MQTT","88","Publish Message [esp32/felipe/dht]","5.155985000"
"124595","1188.565483","192.168.3.103","5.196.78.28","TCP","54","51332  >  1883 [ACK] Seq=39 Ack=7723 Win=254 Len=0","0.052279000"
"124633","1193.805778","5.196.78.28","192.168.3.103","MQTT","88","Publish Message [esp32/felipe/dht]","5.240295000"
"124635","1193.849673","192.168.3.103","5.196.78.28","TCP","54","51332  >  1883 [ACK] Seq=39 Ack=7757 Win=254 Len=0","0.043895000"
"124687","1199.047027","5.196.78.28","192.168.3.103","MQTT","88","Publish Message [esp32/felipe/dht]","5.197354000"
"124688","1199.099705","192.168.3.103","5.196.78.28","TCP","54","51332  >  1883 [ACK] Seq=39 Ack=7791 Win=254 Len=0","0.052678000"
"124695","1200.047776","192.168.3.103","5.196.78.28","MQTT","56","Ping Request","0.948071000"
"124699","1200.262203","5.196.78.28","192.168.3.103","TCP","60","1883  >  51332 [ACK] Seq=7791 Ack=41 Win=502 Len=0","0.214427000"
"124705","1201.237349","5.196.78.28","192.168.3.103","MQTT","60","Ping Response","0.975146000"
"124706","1201.289430","192.168.3.103","5.196.78.28","TCP","54","51332  >  1883 [ACK] Seq=41 Ack=7793 Win=254 Len=0","0.052081000"
"124757","1203.938520","5.196.78.28","192.168.3.103","MQTT","88","Publish Message [esp32/felipe/dht]","2.649090000"
"124760","1203.981736","192.168.3.103","5.196.78.28","TCP","54","51332  >  1883 [ACK] Seq=41 Ack=7827 Win=254 Len=0","0.043216000"
"124864","1209.996040","5.196.78.28","192.168.3.103","MQTT","88","Publish Message [esp32/felipe/dht]","6.014304000"
"124865","1210.049751","192.168.3.103","5.196.78.28","TCP","54","51332  >  1883 [ACK] Seq=41 Ack=7861 Win=254 Len=0","0.053711000"
"124909","1215.196427","5.196.78.28","192.168.3.103","MQTT","88","Publish Message [esp32/felipe/dht]","5.146676000"
"124910","1215.236188","192.168.3.103","5.196.78.28","TCP","54","51332  >  1883 [ACK] Seq=41 Ack=7895 Win=254 Len=0","0.039761000"
"124961","1221.042202","5.196.78.28","192.168.3.103","MQTT","88","Publish Message [esp32/felipe/dht]","5.806014000"
"124962","1221.093979","192.168.3.103","5.196.78.28","TCP","54","51332  >  1883 [ACK] Seq=41 Ack=7929 Win=253 Len=0","0.051777000"
"124994","1225.657755","5.196.78.28","192.168.3.103","MQTT","88","Publish Message [esp32/felipe/dht]","4.563776000"
"124995","1225.698300","192.168.3.103","5.196.78.28","TCP","54","51332  >  1883 [ACK] Seq=41 Ack=7963 Win=253 Len=0","0.040545000"
"125022","1230.748146","5.196.78.28","192.168.3.103","MQTT","88","Publish Message [esp32/felipe/dht]","5.049846000"
"125023","1230.788501","192.168.3.103","5.196.78.28","TCP","54","51332  >  1883 [ACK] Seq=41 Ack=7997 Win=253 Len=0","0.040355000"
"125078","1235.984983","5.196.78.28","192.168.3.103","MQTT","88","Publish Message [esp32/felipe/dht]","5.196482000"
"125079","1236.033107","192.168.3.103","5.196.78.28","TCP","54","51332  >  1883 [ACK] Seq=41 Ack=8031 Win=253 Len=0","0.048124000"
"125119","1241.235990","5.196.78.28","192.168.3.103","MQTT","88","Publish Message [esp32/felipe/dht]","5.202883000"
"125120","1241.290837","192.168.3.103","5.196.78.28","TCP","54","51332  >  1883 [ACK] Seq=41 Ack=8065 Win=253 Len=0","0.054847000"
"125147","1246.584867","5.196.78.28","192.168.3.103","MQTT","88","Publish Message [esp32/felipe/dht]","5.294030000"
"125148","1246.632184","192.168.3.103","5.196.78.28","TCP","54","51332  >  1883 [ACK] Seq=41 Ack=8099 Win=253 Len=0","0.047317000"
"125182","1251.834063","5.196.78.28","192.168.3.103","MQTT","88","Publish Message [esp32/felipe/dht]","5.201879000"
"125183","1251.873603","192.168.3.103","5.196.78.28","TCP","54","51332  >  1883 [ACK] Seq=41 Ack=8133 Win=253 Len=0","0.039540000"
"125204","1256.315998","5.196.78.28","192.168.3.103","MQTT","88","Publish Message [esp32/felipe/dht]","4.442395000"
"125205","1256.365168","192.168.3.103","5.196.78.28","TCP","54","51332  >  1883 [ACK] Seq=41 Ack=8167 Win=253 Len=0","0.049170000"
"125226","1260.361339","192.168.3.103","5.196.78.28","MQTT","56","Ping Request","3.996171000"
"125227","1260.577456","5.196.78.28","192.168.3.103","TCP","60","1883  >  51332 [ACK] Seq=8167 Ack=43 Win=502 Len=0","0.216117000"
"125232","1261.581031","5.196.78.28","192.168.3.103","MQTT","60","Ping Response","1.003575000"
"125233","1261.623763","192.168.3.103","5.196.78.28","TCP","54","51332  >  1883 [ACK] Seq=43 Ack=8169 Win=253 Len=0","0.042732000"
"125237","1262.315354","5.196.78.28","192.168.3.103","MQTT","88","Publish Message [esp32/felipe/dht]","0.691591000"
"125239","1262.368119","192.168.3.103","5.196.78.28","TCP","54","51332  >  1883 [ACK] Seq=43 Ack=8203 Win=252 Len=0","0.052765000"
"125270","1267.380558","5.196.78.28","192.168.3.103","MQTT","88","Publish Message [esp32/felipe/dht]","5.012439000"
"125271","1267.427915","192.168.3.103","5.196.78.28","TCP","54","51332  >  1883 [ACK] Seq=43 Ack=8237 Win=252 Len=0","0.047357000"
"125303","1272.569499","5.196.78.28","192.168.3.103","MQTT","88","Publish Message [esp32/felipe/dht]","5.141584000"
"125305","1272.617315","192.168.3.103","5.196.78.28","TCP","54","51332  >  1883 [ACK] Seq=43 Ack=8271 Win=252 Len=0","0.047816000"
"125348","1277.732076","5.196.78.28","192.168.3.103","MQTT","88","Publish Message [esp32/felipe/dht]","5.114761000"
"125349","1277.777359","192.168.3.103","5.196.78.28","TCP","54","51332  >  1883 [ACK] Seq=43 Ack=8305 Win=252 Len=0","0.045283000"
"125463","1283.436137","5.196.78.28","192.168.3.103","MQTT","88","Publish Message [esp32/felipe/dht]","5.658778000"
"125464","1283.488666","192.168.3.103","5.196.78.28","TCP","54","51332  >  1883 [ACK] Seq=43 Ack=8339 Win=252 Len=0","0.052529000"
"125501","1288.728782","5.196.78.28","192.168.3.103","MQTT","88","Publish Message [esp32/felipe/dht]","5.240116000"
"125502","1288.771909","192.168.3.103","5.196.78.28","TCP","54","51332  >  1883 [ACK] Seq=43 Ack=8373 Win=252 Len=0","0.043127000"
"125543","1293.742064","5.196.78.28","192.168.3.103","MQTT","88","Publish Message [esp32/felipe/dht]","4.970155000"
"125544","1293.793926","192.168.3.103","5.196.78.28","TCP","54","51332  >  1883 [ACK] Seq=43 Ack=8407 Win=252 Len=0","0.051862000"
"125580","1299.102715","5.196.78.28","192.168.3.103","MQTT","88","Publish Message [esp32/felipe/dht]","5.308789000"
"125581","1299.147743","192.168.3.103","5.196.78.28","TCP","54","51332  >  1883 [ACK] Seq=43 Ack=8441 Win=251 Len=0","0.045028000"
"132184","1304.898238","5.196.78.28","192.168.3.103","MQTT","88","Publish Message [esp32/felipe/dht]","5.750495000"
"132185","1304.937635","192.168.3.103","5.196.78.28","TCP","54","51332  >  1883 [ACK] Seq=43 Ack=8475 Win=251 Len=0","0.039397000"
"132249","1309.336444","5.196.78.28","192.168.3.103","MQTT","88","Publish Message [esp32/felipe/dht]","4.398809000"
"132250","1309.388069","192.168.3.103","5.196.78.28","TCP","54","51332  >  1883 [ACK] Seq=43 Ack=8509 Win=251 Len=0","0.051625000"
"132437","1314.954688","5.196.78.28","192.168.3.103","MQTT","88","Publish Message [esp32/felipe/dht]","5.566619000"
"132438","1314.998868","192.168.3.103","5.196.78.28","TCP","54","51332  >  1883 [ACK] Seq=43 Ack=8543 Win=251 Len=0","0.044180000"
"132475","1320.373206","5.196.78.28","192.168.3.103","MQTT","88","Publish Message [esp32/felipe/dht]","5.374338000"
"132476","1320.373541","192.168.3.103","5.196.78.28","MQTT","56","Ping Request","0.000335000"
"132480","1320.588694","5.196.78.28","192.168.3.103","TCP","60","1883  >  51332 [ACK] Seq=8577 Ack=45 Win=502 Len=0","0.215153000"
"132489","1322.011427","5.196.78.28","192.168.3.103","MQTT","60","Ping Response","1.422733000"
"132490","1322.065445","192.168.3.103","5.196.78.28","TCP","54","51332  >  1883 [ACK] Seq=45 Ack=8579 Win=251 Len=0","0.054018000"
"132524","1325.780143","5.196.78.28","192.168.3.103","MQTT","88","Publish Message [esp32/felipe/dht]","3.714698000"
"132526","1325.830399","192.168.3.103","5.196.78.28","TCP","54","51332  >  1883 [ACK] Seq=45 Ack=8613 Win=251 Len=0","0.050256000"
"132565","1331.264154","5.196.78.28","192.168.3.103","MQTT","88","Publish Message [esp32/felipe/dht]","5.433755000"
"132568","1331.316528","192.168.3.103","5.196.78.28","TCP","54","51332  >  1883 [ACK] Seq=45 Ack=8647 Win=251 Len=0","0.052374000"
"132604","1335.696747","5.196.78.28","192.168.3.103","MQTT","88","Publish Message [esp32/felipe/dht]","4.380219000"
"132605","1335.741880","192.168.3.103","5.196.78.28","TCP","54","51332  >  1883 [ACK] Seq=45 Ack=8681 Win=251 Len=0","0.045133000"
"132649","1341.163656","5.196.78.28","192.168.3.103","MQTT","88","Publish Message [esp32/felipe/dht]","5.421776000"
"132651","1341.214369","192.168.3.103","5.196.78.28","TCP","54","51332  >  1883 [ACK] Seq=45 Ack=8715 Win=250 Len=0","0.050713000"
"132714","1346.758594","5.196.78.28","192.168.3.103","MQTT","88","Publish Message [esp32/felipe/dht]","5.544225000"
"132715","1346.813314","192.168.3.103","5.196.78.28","TCP","54","51332  >  1883 [ACK] Seq=45 Ack=8749 Win=250 Len=0","0.054720000"
"132744","1352.156912","5.196.78.28","192.168.3.103","MQTT","88","Publish Message [esp32/felipe/dht]","5.343598000"
"132745","1352.204988","192.168.3.103","5.196.78.28","TCP","54","51332  >  1883 [ACK] Seq=45 Ack=8783 Win=250 Len=0","0.048076000"
"132774","1357.140460","5.196.78.28","192.168.3.103","MQTT","88","Publish Message [esp32/felipe/dht]","4.935472000"
"132775","1357.191574","192.168.3.103","5.196.78.28","TCP","54","51332  >  1883 [ACK] Seq=45 Ack=8817 Win=250 Len=0","0.051114000"
"132809","1362.163969","5.196.78.28","192.168.3.103","MQTT","88","Publish Message [esp32/felipe/dht]","4.972395000"
"132810","1362.214193","192.168.3.103","5.196.78.28","TCP","54","51332  >  1883 [ACK] Seq=45 Ack=8851 Win=255 Len=0","0.050224000"
"132856","1367.476906","5.196.78.28","192.168.3.103","MQTT","88","Publish Message [esp32/felipe/dht]","5.262713000"
"132857","1367.527215","192.168.3.103","5.196.78.28","TCP","54","51332  >  1883 [ACK] Seq=45 Ack=8885 Win=255 Len=0","0.050309000"
"132921","1373.630690","5.196.78.28","192.168.3.103","MQTT","88","Publish Message [esp32/felipe/dht]","6.103475000"
"132924","1373.683783","192.168.3.103","5.196.78.28","TCP","54","51332  >  1883 [ACK] Seq=45 Ack=8919 Win=255 Len=0","0.053093000"
"132973","1378.340171","5.196.78.28","192.168.3.103","MQTT","88","Publish Message [esp32/felipe/dht]","4.656388000"
"132975","1378.395125","192.168.3.103","5.196.78.28","TCP","54","51332  >  1883 [ACK] Seq=45 Ack=8953 Win=255 Len=0","0.054954000"
"132990","1381.357362","192.168.3.103","5.196.78.28","MQTT","56","Ping Request","2.962237000"
"132991","1381.571958","5.196.78.28","192.168.3.103","TCP","60","1883  >  51332 [ACK] Seq=8953 Ack=47 Win=502 Len=0","0.214596000"
"132999","1382.449809","5.196.78.28","192.168.3.103","MQTT","60","Ping Response","0.877851000"
"133000","1382.490109","192.168.3.103","5.196.78.28","TCP","54","51332  >  1883 [ACK] Seq=47 Ack=8955 Win=255 Len=0","0.040300000"
"133005","1383.291266","5.196.78.28","192.168.3.103","MQTT","88","Publish Message [esp32/felipe/dht]","0.801157000"
"133006","1383.342715","192.168.3.103","5.196.78.28","TCP","54","51332  >  1883 [ACK] Seq=47 Ack=8989 Win=255 Len=0","0.051449000"
"133047","1388.686347","5.196.78.28","192.168.3.103","MQTT","88","Publish Message [esp32/felipe/dht]","5.343632000"
"133048","1388.737263","192.168.3.103","5.196.78.28","TCP","54","51332  >  1883 [ACK] Seq=47 Ack=9023 Win=255 Len=0","0.050916000"
"133080","1393.748772","5.196.78.28","192.168.3.103","MQTT","88","Publish Message [esp32/felipe/dht]","5.011509000"
"133082","1393.797559","192.168.3.103","5.196.78.28","TCP","54","51332  >  1883 [ACK] Seq=47 Ack=9057 Win=255 Len=0","0.048787000"
"133116","1399.126694","5.196.78.28","192.168.3.103","MQTT","88","Publish Message [esp32/felipe/dht]","5.329135000"
"133117","1399.180272","192.168.3.103","5.196.78.28","TCP","54","51332  >  1883 [ACK] Seq=47 Ack=9091 Win=255 Len=0","0.053578000"
"133219","1404.551620","5.196.78.28","192.168.3.103","MQTT","88","Publish Message [esp32/felipe/dht]","5.371348000"
"133220","1404.594559","192.168.3.103","5.196.78.28","TCP","54","51332  >  1883 [ACK] Seq=47 Ack=9125 Win=254 Len=0","0.042939000"
"133257","1410.082855","5.196.78.28","192.168.3.103","MQTT","88","Publish Message [esp32/felipe/dht]","5.488296000"
"133259","1410.128566","192.168.3.103","5.196.78.28","TCP","54","51332  >  1883 [ACK] Seq=47 Ack=9159 Win=254 Len=0","0.045711000"
"133301","1415.625440","5.196.78.28","192.168.3.103","MQTT","88","Publish Message [esp32/felipe/dht]","5.496874000"
"133302","1415.677280","192.168.3.103","5.196.78.28","TCP","54","51332  >  1883 [ACK] Seq=47 Ack=9193 Win=254 Len=0","0.051840000"
"133343","1420.298980","5.196.78.28","192.168.3.103","MQTT","88","Publish Message [esp32/felipe/dht]","4.621700000"
"133345","1420.344516","192.168.3.103","5.196.78.28","TCP","54","51332  >  1883 [ACK] Seq=47 Ack=9227 Win=254 Len=0","0.045536000"
"133386","1425.672329","5.196.78.28","192.168.3.103","MQTT","88","Publish Message [esp32/felipe/dht]","5.327813000"
"133387","1425.722011","192.168.3.103","5.196.78.28","TCP","54","51332  >  1883 [ACK] Seq=47 Ack=9261 Win=254 Len=0","0.049682000"
"133424","1431.596856","5.196.78.28","192.168.3.103","MQTT","88","Publish Message [esp32/felipe/dht]","5.874845000"
"133425","1431.641352","192.168.3.103","5.196.78.28","TCP","54","51332  >  1883 [ACK] Seq=47 Ack=9295 Win=254 Len=0","0.044496000"
"133455","1436.871565","5.196.78.28","192.168.3.103","MQTT","88","Publish Message [esp32/felipe/dht]","5.230213000"
"133456","1436.912602","192.168.3.103","5.196.78.28","TCP","54","51332  >  1883 [ACK] Seq=47 Ack=9329 Win=254 Len=0","0.041037000"
"133483","1441.292546","5.196.78.28","192.168.3.103","MQTT","88","Publish Message [esp32/felipe/dht]","4.379944000"
"133484","1441.335850","192.168.3.103","5.196.78.28","TCP","54","51332  >  1883 [ACK] Seq=47 Ack=9363 Win=253 Len=0","0.043304000"
"133487","1442.298890","192.168.3.103","5.196.78.28","MQTT","56","Ping Request","0.963040000"
"133491","1442.515157","5.196.78.28","192.168.3.103","TCP","60","1883  >  51332 [ACK] Seq=9363 Ack=49 Win=502 Len=0","0.216267000"
"133497","1443.694825","5.196.78.28","192.168.3.103","MQTT","60","Ping Response","1.179668000"
"133499","1443.745574","192.168.3.103","5.196.78.28","TCP","54","51332  >  1883 [ACK] Seq=49 Ack=9365 Win=253 Len=0","0.050749000"
"133525","1446.519345","5.196.78.28","192.168.3.103","MQTT","88","Publish Message [esp32/felipe/dht]","2.773771000"
"133527","1446.572063","192.168.3.103","5.196.78.28","TCP","54","51332  >  1883 [ACK] Seq=49 Ack=9399 Win=253 Len=0","0.052718000"
"133560","1452.023980","5.196.78.28","192.168.3.103","MQTT","88","Publish Message [esp32/felipe/dht]","5.451917000"
"133562","1452.067520","192.168.3.103","5.196.78.28","TCP","54","51332  >  1883 [ACK] Seq=49 Ack=9433 Win=253 Len=0","0.043540000"
"133619","1457.449685","5.196.78.28","192.168.3.103","MQTT","88","Publish Message [esp32/felipe/dht]","5.382165000"
"133621","1457.499832","192.168.3.103","5.196.78.28","TCP","54","51332  >  1883 [ACK] Seq=49 Ack=9467 Win=253 Len=0","0.050147000"
"133652","1462.920393","5.196.78.28","192.168.3.103","MQTT","88","Publish Message [esp32/felipe/dht]","5.420561000"
"133653","1462.971873","192.168.3.103","5.196.78.28","TCP","54","51332  >  1883 [ACK] Seq=49 Ack=9501 Win=253 Len=0","0.051480000"
"133689","1468.690708","5.196.78.28","192.168.3.103","MQTT","88","Publish Message [esp32/felipe/dht]","5.718835000"
"133691","1468.736246","192.168.3.103","5.196.78.28","TCP","54","51332  >  1883 [ACK] Seq=49 Ack=9535 Win=253 Len=0","0.045538000"
"133720","1473.456520","5.196.78.28","192.168.3.103","MQTT","88","Publish Message [esp32/felipe/dht]","4.720274000"
"133721","1473.505989","192.168.3.103","5.196.78.28","TCP","54","51332  >  1883 [ACK] Seq=49 Ack=9569 Win=253 Len=0","0.049469000"
"133757","1478.624596","5.196.78.28","192.168.3.103","MQTT","88","Publish Message [esp32/felipe/dht]","5.118607000"
"133758","1478.672915","192.168.3.103","5.196.78.28","TCP","54","51332  >  1883 [ACK] Seq=49 Ack=9603 Win=253 Len=0","0.048319000"
"133787","1483.606732","5.196.78.28","192.168.3.103","MQTT","88","Publish Message [esp32/felipe/dht]","4.933817000"
"133788","1483.657927","192.168.3.103","5.196.78.28","TCP","54","51332  >  1883 [ACK] Seq=49 Ack=9637 Win=252 Len=0","0.051195000"
"133819","1488.820242","5.196.78.28","192.168.3.103","MQTT","88","Publish Message [esp32/felipe/dht]","5.162315000"
"133820","1488.869484","192.168.3.103","5.196.78.28","TCP","54","51332  >  1883 [ACK] Seq=49 Ack=9671 Win=252 Len=0","0.049242000"
"133843","1494.225270","5.196.78.28","192.168.3.103","MQTT","88","Publish Message [esp32/felipe/dht]","5.355786000"
"133844","1494.273348","192.168.3.103","5.196.78.28","TCP","54","51332  >  1883 [ACK] Seq=49 Ack=9705 Win=252 Len=0","0.048078000"
"133920","1499.938547","5.196.78.28","192.168.3.103","MQTT","88","Publish Message [esp32/felipe/dht]","5.665199000"
"133921","1499.985523","192.168.3.103","5.196.78.28","TCP","54","51332  >  1883 [ACK] Seq=49 Ack=9739 Win=252 Len=0","0.046976000"
"133965","1502.954050","192.168.3.103","5.196.78.28","MQTT","56","Ping Request","2.968527000"
"133967","1503.170361","5.196.78.28","192.168.3.103","TCP","60","1883  >  51332 [ACK] Seq=9739 Ack=51 Win=502 Len=0","0.216311000"
"133978","1504.802458","5.196.78.28","192.168.3.103","MQTT","60","Ping Response","1.632097000"
"133979","1504.854135","192.168.3.103","5.196.78.28","TCP","54","51332  >  1883 [ACK] Seq=51 Ack=9741 Win=252 Len=0","0.051677000"
"133981","1505.015286","5.196.78.28","192.168.3.103","MQTT","88","Publish Message [esp32/felipe/dht]","0.161151000"
"133982","1505.055448","192.168.3.103","5.196.78.28","TCP","54","51332  >  1883 [ACK] Seq=51 Ack=9775 Win=252 Len=0","0.040162000"
"134009","1510.723260","5.196.78.28","192.168.3.103","MQTT","88","Publish Message [esp32/felipe/dht]","5.667812000"
"134010","1510.768181","192.168.3.103","5.196.78.28","TCP","54","51332  >  1883 [ACK] Seq=51 Ack=9809 Win=252 Len=0","0.044921000"
"134032","1515.631974","5.196.78.28","192.168.3.103","MQTT","88","Publish Message [esp32/felipe/dht]","4.863793000"
"134033","1515.676885","192.168.3.103","5.196.78.28","TCP","54","51332  >  1883 [ACK] Seq=51 Ack=9843 Win=252 Len=0","0.044911000"
"134068","1521.503202","5.196.78.28","192.168.3.103","MQTT","88","Publish Message [esp32/felipe/dht]","5.826317000"
"134069","1521.551170","192.168.3.103","5.196.78.28","TCP","54","51332  >  1883 [ACK] Seq=51 Ack=9877 Win=251 Len=0","0.047968000"
"134094","1526.475480","5.196.78.28","192.168.3.103","MQTT","88","Publish Message [esp32/felipe/dht]","4.924310000"
"134095","1526.529564","192.168.3.103","5.196.78.28","TCP","54","51332  >  1883 [ACK] Seq=51 Ack=9911 Win=251 Len=0","0.054084000"
"134130","1531.734616","5.196.78.28","192.168.3.103","MQTT","88","Publish Message [esp32/felipe/dht]","5.205052000"
"134131","1531.779307","192.168.3.103","5.196.78.28","TCP","54","51332  >  1883 [ACK] Seq=51 Ack=9945 Win=251 Len=0","0.044691000"
"134166","1537.102933","5.196.78.28","192.168.3.103","MQTT","88","Publish Message [esp32/felipe/dht]","5.323626000"
"134168","1537.148095","192.168.3.103","5.196.78.28","TCP","54","51332  >  1883 [ACK] Seq=51 Ack=9979 Win=251 Len=0","0.045162000"
"134194","1541.765599","5.196.78.28","192.168.3.103","MQTT","88","Publish Message [esp32/felipe/dht]","4.617504000"
"134195","1541.814368","192.168.3.103","5.196.78.28","TCP","54","51332  >  1883 [ACK] Seq=51 Ack=10013 Win=251 Len=0","0.048769000"
"134222","1547.125655","5.196.78.28","192.168.3.103","MQTT","88","Publish Message [esp32/felipe/dht]","5.311287000"
"134223","1547.175195","192.168.3.103","5.196.78.28","TCP","54","51332  >  1883 [ACK] Seq=51 Ack=10047 Win=251 Len=0","0.049540000"
"134266","1552.212336","5.196.78.28","192.168.3.103","MQTT","88","Publish Message [esp32/felipe/dht]","5.037141000"
"134272","1552.257675","192.168.3.103","5.196.78.28","TCP","54","51332  >  1883 [ACK] Seq=51 Ack=10081 Win=251 Len=0","0.045339000"
"134307","1557.978357","5.196.78.28","192.168.3.103","MQTT","88","Publish Message [esp32/felipe/dht]","5.720682000"
"134308","1558.029598","192.168.3.103","5.196.78.28","TCP","54","51332  >  1883 [ACK] Seq=51 Ack=10115 Win=251 Len=0","0.051241000"
"134327","1562.811235","5.196.78.28","192.168.3.103","MQTT","88","Publish Message [esp32/felipe/dht]","4.781637000"
"134328","1562.861128","192.168.3.103","5.196.78.28","TCP","54","51332  >  1883 [ACK] Seq=51 Ack=10149 Win=250 Len=0","0.049893000"
"134332","1563.824539","192.168.3.103","5.196.78.28","MQTT","56","Ping Request","0.963411000"
"134333","1564.041594","5.196.78.28","192.168.3.103","TCP","60","1883  >  51332 [ACK] Seq=10149 Ack=53 Win=502 Len=0","0.217055000"
"134362","1565.202244","5.196.78.28","192.168.3.103","MQTT","60","Ping Response","1.160650000"
"134364","1565.252730","192.168.3.103","5.196.78.28","TCP","54","51332  >  1883 [ACK] Seq=53 Ack=10151 Win=250 Len=0","0.050486000"
"134384","1568.552228","5.196.78.28","192.168.3.103","MQTT","88","Publish Message [esp32/felipe/dht]","3.299498000"
"134385","1568.597533","192.168.3.103","5.196.78.28","TCP","54","51332  >  1883 [ACK] Seq=53 Ack=10185 Win=250 Len=0","0.045305000"
"134412","1573.978320","5.196.78.28","192.168.3.103","MQTT","88","Publish Message [esp32/felipe/dht]","5.380787000"
"134413","1574.029323","192.168.3.103","5.196.78.28","TCP","54","51332  >  1883 [ACK] Seq=53 Ack=10219 Win=250 Len=0","0.051003000"
"134455","1579.501524","5.196.78.28","192.168.3.103","MQTT","88","Publish Message [esp32/felipe/dht]","5.472201000"
"134456","1579.549542","192.168.3.103","5.196.78.28","TCP","54","51332  >  1883 [ACK] Seq=53 Ack=10253 Win=250 Len=0","0.048018000"
"134594","1584.959355","5.196.78.28","192.168.3.103","MQTT","88","Publish Message [esp32/felipe/dht]","5.409813000"
"134596","1585.005038","192.168.3.103","5.196.78.28","TCP","54","51332  >  1883 [ACK] Seq=53 Ack=10287 Win=255 Len=0","0.045683000"
"134625","1589.776517","5.196.78.28","192.168.3.103","MQTT","88","Publish Message [esp32/felipe/dht]","4.771479000"
"134626","1589.830044","192.168.3.103","5.196.78.28","TCP","54","51332  >  1883 [ACK] Seq=53 Ack=10321 Win=255 Len=0","0.053527000"
"136386","1594.451657","5.196.78.28","192.168.3.103","MQTT","88","Publish Message [esp32/felipe/dht]","4.621613000"
"136390","1594.501858","192.168.3.103","5.196.78.28","TCP","54","51332  >  1883 [ACK] Seq=53 Ack=10355 Win=255 Len=0","0.050201000"
"136432","1600.136478","5.196.78.28","192.168.3.103","MQTT","88","Publish Message [esp32/felipe/dht]","5.634620000"
"136433","1600.181165","192.168.3.103","5.196.78.28","TCP","54","51332  >  1883 [ACK] Seq=53 Ack=10389 Win=255 Len=0","0.044687000"
"136455","1605.556527","5.196.78.28","192.168.3.103","MQTT","88","Publish Message [esp32/felipe/dht]","5.375362000"
"136458","1605.604223","192.168.3.103","5.196.78.28","TCP","54","51332  >  1883 [ACK] Seq=53 Ack=10423 Win=255 Len=0","0.047696000"
"136494","1610.797134","5.196.78.28","192.168.3.103","MQTT","88","Publish Message [esp32/felipe/dht]","5.192911000"
"136495","1610.849664","192.168.3.103","5.196.78.28","TCP","54","51332  >  1883 [ACK] Seq=53 Ack=10457 Win=255 Len=0","0.052530000"
"136525","1616.253484","5.196.78.28","192.168.3.103","MQTT","88","Publish Message [esp32/felipe/dht]","5.403820000"
"136526","1616.306927","192.168.3.103","5.196.78.28","TCP","54","51332  >  1883 [ACK] Seq=53 Ack=10491 Win=255 Len=0","0.053443000"
"136550","1621.900027","5.196.78.28","192.168.3.103","MQTT","88","Publish Message [esp32/felipe/dht]","5.593100000"
"136551","1621.941051","192.168.3.103","5.196.78.28","TCP","54","51332  >  1883 [ACK] Seq=53 Ack=10525 Win=255 Len=0","0.041024000"
"136564","1623.915496","192.168.3.103","5.196.78.28","MQTT","56","Ping Request","1.974445000"
"136567","1624.132832","5.196.78.28","192.168.3.103","TCP","60","1883  >  51332 [ACK] Seq=10525 Ack=55 Win=502 Len=0","0.217336000"
"136577","1625.570041","5.196.78.28","192.168.3.103","MQTT","60","Ping Response","1.437209000"
"136580","1625.614191","192.168.3.103","5.196.78.28","TCP","54","51332  >  1883 [ACK] Seq=55 Ack=10527 Win=255 Len=0","0.044150000"
"136585","1626.719116","5.196.78.28","192.168.3.103","MQTT","88","Publish Message [esp32/felipe/dht]","1.104925000"
"136586","1626.761217","192.168.3.103","5.196.78.28","TCP","54","51332  >  1883 [ACK] Seq=55 Ack=10561 Win=254 Len=0","0.042101000"
"136618","1631.572577","5.196.78.28","192.168.3.103","MQTT","88","Publish Message [esp32/felipe/dht]","4.811360000"
"136619","1631.623616","192.168.3.103","5.196.78.28","TCP","54","51332  >  1883 [ACK] Seq=55 Ack=10595 Win=254 Len=0","0.051039000"
"136647","1636.721962","5.196.78.28","192.168.3.103","MQTT","88","Publish Message [esp32/felipe/dht]","5.098346000"
"136648","1636.769268","192.168.3.103","5.196.78.28","TCP","54","51332  >  1883 [ACK] Seq=55 Ack=10629 Win=254 Len=0","0.047306000"
"136681","1642.528196","5.196.78.28","192.168.3.103","MQTT","88","Publish Message [esp32/felipe/dht]","5.758928000"
"136682","1642.581398","192.168.3.103","5.196.78.28","TCP","54","51332  >  1883 [ACK] Seq=55 Ack=10663 Win=254 Len=0","0.053202000"
"136737","1648.105428","5.196.78.28","192.168.3.103","MQTT","88","Publish Message [esp32/felipe/dht]","5.524030000"
"136738","1648.156769","192.168.3.103","5.196.78.28","TCP","54","51332  >  1883 [ACK] Seq=55 Ack=10697 Win=254 Len=0","0.051341000"
"136845","1653.749933","5.196.78.28","192.168.3.103","MQTT","88","Publish Message [esp32/felipe/dht]","5.593164000"
"136846","1653.793670","192.168.3.103","5.196.78.28","TCP","54","51332  >  1883 [ACK] Seq=55 Ack=10731 Win=254 Len=0","0.043737000"
"136909","1658.124721","5.196.78.28","192.168.3.103","MQTT","88","Publish Message [esp32/felipe/dht]","4.331051000"
"136914","1658.177011","192.168.3.103","5.196.78.28","TCP","54","51332  >  1883 [ACK] Seq=55 Ack=10765 Win=254 Len=0","0.052290000"
"137018","1663.307782","5.196.78.28","192.168.3.103","MQTT","88","Publish Message [esp32/felipe/dht]","5.130771000"
"137019","1663.350874","192.168.3.103","5.196.78.28","TCP","54","51332  >  1883 [ACK] Seq=55 Ack=10799 Win=253 Len=0","0.043092000"
"137058","1668.757037","5.196.78.28","192.168.3.103","MQTT","88","Publish Message [esp32/felipe/dht]","5.406163000"
"137060","1668.805313","192.168.3.103","5.196.78.28","TCP","54","51332  >  1883 [ACK] Seq=55 Ack=10833 Win=253 Len=0","0.048276000"
"137108","1673.656525","5.196.78.28","192.168.3.103","MQTT","88","Publish Message [esp32/felipe/dht]","4.851212000"
"137109","1673.700544","192.168.3.103","5.196.78.28","TCP","54","51332  >  1883 [ACK] Seq=55 Ack=10867 Win=253 Len=0","0.044019000"
"137141","1678.744064","5.196.78.28","192.168.3.103","MQTT","88","Publish Message [esp32/felipe/dht]","5.043520000"
"137142","1678.794084","192.168.3.103","5.196.78.28","TCP","54","51332  >  1883 [ACK] Seq=55 Ack=10901 Win=253 Len=0","0.050020000"
"137184","1684.339395","5.196.78.28","192.168.3.103","MQTT","88","Publish Message [esp32/felipe/dht]","5.545311000"
"137185","1684.339788","192.168.3.103","5.196.78.28","MQTT","56","Ping Request","0.000393000"
"137188","1684.556115","5.196.78.28","192.168.3.103","TCP","60","1883  >  51332 [ACK] Seq=10935 Ack=57 Win=502 Len=0","0.216327000"
"137198","1685.316641","5.196.78.28","192.168.3.103","MQTT","60","Ping Response","0.760526000"
"137202","1685.362369","192.168.3.103","5.196.78.28","TCP","54","51332  >  1883 [ACK] Seq=57 Ack=10937 Win=253 Len=0","0.045728000"
"137249","1689.419996","5.196.78.28","192.168.3.103","MQTT","88","Publish Message [esp32/felipe/dht]","4.057627000"
"137250","1689.467509","192.168.3.103","5.196.78.28","TCP","54","51332  >  1883 [ACK] Seq=57 Ack=10971 Win=253 Len=0","0.047513000"
"137320","1694.888757","5.196.78.28","192.168.3.103","MQTT","88","Publish Message [esp32/felipe/dht]","5.421248000"
"137321","1694.930447","192.168.3.103","5.196.78.28","TCP","54","51332  >  1883 [ACK] Seq=57 Ack=11005 Win=253 Len=0","0.041690000"
"137349","1699.966427","5.196.78.28","192.168.3.103","MQTT","88","Publish Message [esp32/felipe/dht]","5.035980000"
"137350","1700.007929","192.168.3.103","5.196.78.28","TCP","54","51332  >  1883 [ACK] Seq=57 Ack=11039 Win=253 Len=0","0.041502000"
"137414","1705.688903","5.196.78.28","192.168.3.103","MQTT","88","Publish Message [esp32/felipe/dht]","5.680974000"
"137415","1705.738688","192.168.3.103","5.196.78.28","TCP","54","51332  >  1883 [ACK] Seq=57 Ack=11073 Win=252 Len=0","0.049785000"
"137448","1710.625740","5.196.78.28","192.168.3.103","MQTT","88","Publish Message [esp32/felipe/dht]","4.887052000"
"137449","1710.677393","192.168.3.103","5.196.78.28","TCP","54","51332  >  1883 [ACK] Seq=57 Ack=11107 Win=252 Len=0","0.051653000"
"137484","1715.742650","5.196.78.28","192.168.3.103","MQTT","88","Publish Message [esp32/felipe/dht]","5.065257000"
"137485","1715.789455","192.168.3.103","5.196.78.28","TCP","54","51332  >  1883 [ACK] Seq=57 Ack=11141 Win=252 Len=0","0.046805000"
"137522","1722.016098","5.196.78.28","192.168.3.103","MQTT","88","Publish Message [esp32/felipe/dht]","6.226643000"
"137523","1722.056591","192.168.3.103","5.196.78.28","TCP","54","51332  >  1883 [ACK] Seq=57 Ack=11175 Win=252 Len=0","0.040493000"
"137549","1726.500714","5.196.78.28","192.168.3.103","MQTT","88","Publish Message [esp32/felipe/dht]","4.444123000"
"137550","1726.549347","192.168.3.103","5.196.78.28","TCP","54","51332  >  1883 [ACK] Seq=57 Ack=11209 Win=252 Len=0","0.048633000"
"137581","1731.731710","5.196.78.28","192.168.3.103","MQTT","88","Publish Message [esp32/felipe/dht]","5.182363000"
"137582","1731.782740","192.168.3.103","5.196.78.28","TCP","54","51332  >  1883 [ACK] Seq=57 Ack=11243 Win=252 Len=0","0.051030000"
"137615","1737.014329","5.196.78.28","192.168.3.103","MQTT","88","Publish Message [esp32/felipe/dht]","5.231589000"
"137616","1737.065122","192.168.3.103","5.196.78.28","TCP","54","51332  >  1883 [ACK] Seq=57 Ack=11277 Win=252 Len=0","0.050793000"
"137636","1741.926391","5.196.78.28","192.168.3.103","MQTT","88","Publish Message [esp32/felipe/dht]","4.861269000"
"137637","1741.979002","192.168.3.103","5.196.78.28","TCP","54","51332  >  1883 [ACK] Seq=57 Ack=11311 Win=251 Len=0","0.052611000"
"137660","1744.938867","192.168.3.103","5.196.78.28","MQTT","56","Ping Request","2.959865000"
"137662","1745.155368","5.196.78.28","192.168.3.103","TCP","60","1883  >  51332 [ACK] Seq=11311 Ack=59 Win=502 Len=0","0.216501000"
"137668","1745.933975","5.196.78.28","192.168.3.103","MQTT","60","Ping Response","0.778607000"
"137669","1745.976745","192.168.3.103","5.196.78.28","TCP","54","51332  >  1883 [ACK] Seq=59 Ack=11313 Win=251 Len=0","0.042770000"
"137677","1747.248513","5.196.78.28","192.168.3.103","MQTT","88","Publish Message [esp32/felipe/dht]","1.271768000"
"137679","1747.303462","192.168.3.103","5.196.78.28","TCP","54","51332  >  1883 [ACK] Seq=59 Ack=11347 Win=251 Len=0","0.054949000"
"137711","1752.366965","5.196.78.28","192.168.3.103","MQTT","88","Publish Message [esp32/felipe/dht]","5.063503000"
"137713","1752.417396","192.168.3.103","5.196.78.28","TCP","54","51332  >  1883 [ACK] Seq=59 Ack=11381 Win=251 Len=0","0.050431000"
"137782","1758.229950","5.196.78.28","192.168.3.103","MQTT","88","Publish Message [esp32/felipe/dht]","5.812554000"
"137797","1758.278683","192.168.3.103","5.196.78.28","TCP","54","51332  >  1883 [ACK] Seq=59 Ack=11415 Win=251 Len=0","0.048733000"
"138204","1763.926947","5.196.78.28","192.168.3.103","MQTT","88","Publish Message [esp32/felipe/dht]","5.648264000"
"138205","1763.979550","192.168.3.103","5.196.78.28","TCP","54","51332  >  1883 [ACK] Seq=59 Ack=11449 Win=251 Len=0","0.052603000"
"138233","1768.865227","5.196.78.28","192.168.3.103","MQTT","88","Publish Message [esp32/felipe/dht]","4.885677000"
"138234","1768.912773","192.168.3.103","5.196.78.28","TCP","54","51332  >  1883 [ACK] Seq=59 Ack=11483 Win=251 Len=0","0.047546000"
"138280","1773.967607","5.196.78.28","192.168.3.103","MQTT","88","Publish Message [esp32/felipe/dht]","5.054834000"
"138281","1774.017967","192.168.3.103","5.196.78.28","TCP","54","51332  >  1883 [ACK] Seq=59 Ack=11517 Win=251 Len=0","0.050360000"
"138323","1778.955412","5.196.78.28","192.168.3.103","MQTT","88","Publish Message [esp32/felipe/dht]","4.937445000"
"138325","1779.000639","192.168.3.103","5.196.78.28","TCP","54","51332  >  1883 [ACK] Seq=59 Ack=11551 Win=251 Len=0","0.045227000"
"138369","1784.185346","5.196.78.28","192.168.3.103","MQTT","88","Publish Message [esp32/felipe/dht]","5.184707000"
"138371","1784.230769","192.168.3.103","5.196.78.28","TCP","54","51332  >  1883 [ACK] Seq=59 Ack=11585 Win=250 Len=0","0.045423000"
"138435","1790.001770","5.196.78.28","192.168.3.103","MQTT","88","Publish Message [esp32/felipe/dht]","5.771001000"
"138436","1790.043712","192.168.3.103","5.196.78.28","TCP","54","51332  >  1883 [ACK] Seq=59 Ack=11619 Win=250 Len=0","0.041942000"
"138461","1795.359828","5.196.78.28","192.168.3.103","MQTT","88","Publish Message [esp32/felipe/dht]","5.316116000"
"138464","1795.405697","192.168.3.103","5.196.78.28","TCP","54","51332  >  1883 [ACK] Seq=59 Ack=11653 Win=250 Len=0","0.045869000"
"138489","1800.799093","5.196.78.28","192.168.3.103","MQTT","88","Publish Message [esp32/felipe/dht]","5.393396000"
"138490","1800.847213","192.168.3.103","5.196.78.28","TCP","54","51332  >  1883 [ACK] Seq=59 Ack=11687 Win=250 Len=0","0.048120000"
